headline,description,link,source,author,query_used,pub_datetime,pub_date,scraped_at
How can businesses use your data to charge you more?,"rom airline tickets and e-commerce to rideshares and food delivery, some companies are quietly using your personal data to decide how much you pay — and it could mean you’re paying more than the person next to you. 
The post How can businesses use your data t…",https://www.digitaljournal.com/business/how-can-businesses-use-your-data-to-charge-you-more/article,Digital Journal,Dr. Tim Sandle,industry,2025-11-01T00:12:00Z,2025-11-01,2025-11-03T00:32:08Z
"From OGG To ORD To LAX, Where Do Airport Three-Letter Codes Come From?","For more than 50 years, airports around the world have been designated by three-letter codes, that usually—but not always—refer to their cities like ATL, DEN, and LAX.",https://www.forbes.com/sites/michaelgoldstein/2025/10/31/from-ogg-to-ord-to-lax-where-do-airport-three-letter-codes-come-from/,Forbes,"Michael Goldstein, Contributor, 
 Michael Goldstein, Contributor
 https://www.forbes.com/sites/michaelgoldstein/",industry,2025-10-31T23:14:22Z,2025-10-31,2025-11-03T00:32:08Z
You can now earn Southwest Airlines points with a debit card—here’s how it works,"Southwest Airlines has launched a new debit card that earns Rapid Rewards points on everyday spending. Here’s what to know about the fees, bonuses, and...",https://creators.yahoo.com/lifestyle/story/you-can-now-earn-southwest-airlines-points-with-a-debit-cardheres-how-it-works-215426469.html,Yahoo Entertainment,Tamara Gane,industry,2025-10-31T21:54:26Z,2025-10-31,2025-11-03T00:32:08Z
Pack This Essential Bluetooth Dongle for Holiday Flights. You'll Thank Me When You Land,Don't waste your time with awful airline earbuds. The AirFly makes in-flight entertainment enjoyable again.,https://www.cnet.com/deals/this-bluetooth-dongle-is-essential-for-holiday-flights-youll-thank-me-when-you-land/,CNET,Nelson Aguilar,industry,2025-10-31T21:52:00Z,2025-10-31,2025-11-03T00:32:08Z
Magnifica Air Wants to Bring Luxe Flying to Travelers Who Can’t Afford Private Jets,"Magnifica Air is a luxury airline launching in 2027, aiming to bring the VIP travel experience to flyers who can't quite afford private jets.",https://matadornetwork.com/read/magnifica-air/,Matadornetwork.com,Suzie Dundas,industry,2025-10-31T20:34:22Z,2025-10-31,2025-11-03T00:32:08Z
Airline CEOs Went to the White House. Here’s What They Want,Airline industry leaders are now amping up the pressure on Congress to pass a short-term spending bill to reopen the government as air traffic controllers miss their first paychecks and delays caused by staffing shortages continue to pile up at airports acros…,http://skift.com/2025/10/31/airline-ceos-attend-white-house-meeting-on-shutdown/,Skift,Meghna Maharishi,industry,2025-10-31T20:32:56Z,2025-10-31,2025-11-03T00:32:08Z
Airline popular with tourists will run unexpected flight to Iraq,"With U.S. forces withdrawing from Iraq in 2003, the war that began in 2003 as part of George W. Bush's wider war on terror after 9/11 continues to have far-reaching consequences across the region.
Regular breakouts of political instability between the governm…",https://biztoc.com/x/c07734dc8913effc,Biztoc.com,thestreet.com,industry,2025-10-31T19:15:46Z,2025-10-31,2025-11-03T00:32:08Z
Can American Airlines Get Its Groove Back? Here’s What It’ll Take To Be ‘Something Special In The Air’ Again,"American Airlines once promised to be “Something Special in the Air.” They lost that spark as managment misjudged every industry trend over the last 12 years. Now, as the airline talks premium, the real question is whether it can rediscover what made it great…",https://viewfromthewing.com/can-american-airlines-get-its-groove-back-heres-what-itll-take-to-be-something-special-in-the-air-again/,Viewfromthewing.com,Gary Leff,industry,2025-10-31T18:34:48Z,2025-10-31,2025-11-03T00:32:08Z
WATCH: JetBlue flight makes emergency landing after losing altitude,"A JetBlue flight traveling from Mexico to New Jersey on Thursday made an emergency landing after experiencing a drop in altitude, leaving several passengers injured, according to the airline.",https://abcnews.go.com/US/video/jetblue-flight-makes-emergency-landing-after-losing-altitude-127070458,ABC News,ABC News,industry,2025-10-31T18:31:12Z,2025-10-31,2025-11-03T00:32:08Z
Your CVS Purchases Can Now Earn Airline Points — Here’s the Trick,"Until recently, there haven’t been many ways to earn travel points from everyday, boring purchases.Sure, you could earn credit card points — but that’s tied to the bank, not the…",https://yourmileagemayvary.com/2025/10/31/earn-virgin-red-points-at-cvs/,Yourmileagemayvary.com,Your Mileage May Vary,industry,2025-10-31T18:13:32Z,2025-10-31,2025-11-03T00:32:08Z
"New Airline Competition: Facts, Myths & Misinformation",Tough realities v obsolete planning. A candid look at airline competition and the future realities of air transportation in the USA.,https://www.forbes.com/sites/mikeboyd/2025/10/31/new-airline-competition-facts-myths--misinformation/,Forbes,"Michael Boyd, Contributor, 
 Michael Boyd, Contributor
 https://www.forbes.com/sites/mikeboyd/",industry,2025-10-31T18:06:06Z,2025-10-31,2025-11-03T00:32:08Z
Forfeiture of Russian plane seized in Toronto requires feds to ‘disentangle’ ownership,Foreign Affairs Minister Anita Anand says pursuing forfeiture of a seized Russian cargo plane that has been parked for years at Toronto Pearson International Airport has forced the government to “disentangle” the aircraft's complex ownership structure.,https://www.cbc.ca/news/politics/russian-antonov-ownership-9.6961945,CBC News,NA,industry,2025-10-31T18:01:27Z,2025-10-31,2025-11-03T00:32:08Z
"Cranky Weekly Review presented by Oakland San Francisco Bay Airport: DOT Slashes Mexico Service, Southwest Execs Seen Shopping for Loungewear","The long-awaited part three of our look at what’s wrong with American is now live. This week, we talk about the importance of leadership and what’s lacking at the airline. You get an extended director’s cut this week since there was some confusion with our pr…",https://crankyflier.com/2025/10/31/cranky-weekly-review-presented-by-oakland-san-francisco-bay-airport-dot-slashes-mexico-service-southwest-execs-seen-shopping-for-loungewear/,Crankyflier.com,Andrew,industry,2025-10-31T18:00:00Z,2025-10-31,2025-11-03T00:32:08Z
"After Attendants Fight, United Delays Flight","A United Airlines flight from Des Moines, Iowa, to Chicago was delayed more than four hours on Monday, but not for any of the usual reasons. Passengers boarded Flight 2138 expecting a quick trip, only to be caught in the fallout from an apparent onboard blowu…",https://www.newser.com/story/377880/after-attendants-fight-united-delays-flight.html,Newser,Jenn Gidman with Newser.AI,industry,2025-10-31T17:41:00Z,2025-10-31,2025-11-03T00:32:08Z
Unfriendly skies: Airline CEOs pressure Congress to pass funding bill as flight disruptions mount,"If you are flying anytime soon, you may need to be prepared for some turbulence.",https://finance.yahoo.com/news/unfriendly-skies-airline-ceos-pressure-congress-to-pass-funding-bill-as-flight-disruptions-mount-173639343.html,Yahoo Entertainment,Pras Subramanian,industry,2025-10-31T17:36:39Z,2025-10-31,2025-11-03T00:32:08Z
DGCA notifies grievance redressal system for disability-friendly air travel,"DGCA enforces new rules for airlines and airports to protect passenger rights and ensure accessible, barrier-free air travel for persons with disabilities.",https://www.thehindubusinessline.com/economy/logistics/dgca-notifies-grievance-redressal-system-for-disability-friendly-air-travel/article70227091.ece,BusinessLine,Rohit  Vaid,industry,2025-10-31T17:16:51Z,2025-10-31,2025-11-03T00:32:08Z
"Full Video: Oman Air’s New Strategy Focuses on Point-to-Point, Not Playing Catch-Up","Oman Air would like to prove that smaller carriers can punch above their weight—if they stay focused. Its CEO is betting on Oman’s natural strengths, smarter distribution, and a full-scale digital reboot to turn the airline into a leaner, more profitable glob…",http://skift.com/2025/10/31/full-video-oman-airs-new-strategy-focuses-on-point-to-point-not-playing-catch-up/,Skift,Darin Graham,industry,2025-10-31T17:13:30Z,2025-10-31,2025-11-03T00:32:08Z
China Eastern Airlines and Shanghai Airport Authority Unveil Key Achievements at 2025 North Bund International Aviation Forum,"SHANGHAI, Oct. 31, 2025 (GLOBE NEWSWIRE) -- The 2025 North Bund International Aviation Forum opened today at the Grand Halls in Shanghai, China, organized by the Ministry of Transport of the People's Republic of China and Shanghai Municipal People's Governmen…",https://www.globenewswire.com/news-release/2025/10/31/3178526/0/en/China-Eastern-Airlines-and-Shanghai-Airport-Authority-Unveil-Key-Achievements-at-2025-North-Bund-International-Aviation-Forum.html,GlobeNewswire,China Eastern Airlines,industry,2025-10-31T16:35:00Z,2025-10-31,2025-11-03T00:32:08Z
"An international airline to be shut down, all flights canceled","The start of the fall has been a difficult time for a number of smaller and low-cost airlines around the world.
Scandinavian budget carriers Play and Braathens both left travelers across Europe stranded after abruptly shutting down all operations within a few…",https://biztoc.com/x/eeb434aa43331d0e,Biztoc.com,thestreet.com,industry,2025-10-31T16:08:33Z,2025-10-31,2025-11-03T00:32:08Z
Disney Trips Ruined: FAA Staffing Crunch Leaves Travelers Stranded,"A shortage of air traffic controllers created widespread travel headaches for guests heading to The Most Magical Place on Earth last night. According to advisories issued by the Federal Aviation Administration (FAA), a ground delay program was put in place fo…",https://insidethemagic.net/2025/10/disney-trips-ruined-faa-staffing-crunch-leaves-travelers-stranded-em1/,Inside the Magic,Eva Miller,industry,2025-10-31T15:48:51Z,2025-10-31,2025-11-03T00:32:08Z
Southwest Airlines gets green light for first-ever airport lounge in Hawaii,"Southwest Airlines gained state approval for its first-ever airport lounge in Hawaii, at Daniel K. Inouye International Airport (HNL).",https://thepointsguy.com/news/southwest-airlines-lounge-honolulu/,The Points Guy,Sean Cudahy,industry,2025-10-31T15:45:52Z,2025-10-31,2025-11-03T00:32:08Z
Delta Continues to Grow in Austin With Three More Routes Added to the Map,"Delta Air Lines continues to expand at Austin-Bergstrom International Airport (AUS) with three new…
The post Delta Continues to Grow in Austin With Three More Routes Added to the Map appeared first on The Bulkhead Seat.",https://thebulkheadseat.com/delta-continues-to-grow-in-austin-with-three-more-routes-added-to-the-map/,Thebulkheadseat.com,The Bulkhead Seat,industry,2025-10-31T15:21:39Z,2025-10-31,2025-11-03T00:32:08Z
JetBlue’s Stock Tanks On Weak Outlook And Concerns Over Higher Costs,JetBlue stock take a nosedive as the management gives a cautious 2025 outlook. Rising costs and intense competition could be a major concern.,https://www.forbes.com/sites/ankitadhawan/2025/10/31/jetblues-stock-tanks-on-weak-outlook-and-concerns-over-higher-costs/,Forbes,"Ankita Dhawan, Contributor, 
 Ankita Dhawan, Contributor
 https://www.forbes.com/sites/ankitadhawan/",industry,2025-10-31T15:19:43Z,2025-10-31,2025-11-03T00:32:08Z
"Flight Delays Hit Austin, Nashville And Newark Friday After 3 Air Traffic Staffing Alerts","With high winds expected to hamper East Coast hubs on Friday, air traffic controllers continue to call out of work in greater numbers after missing their first full paycheck—leading to further flight delays.",https://www.forbes.com/sites/suzannerowankelleher/2025/10/31/flight-delays-friday-3-air-traffic-staffing-alerts/,Forbes,"Suzanne Rowan Kelleher, Forbes Staff, 
 Suzanne Rowan Kelleher, Forbes Staff
 https://www.forbes.com/sites/suzannerowankelleher/",industry,2025-10-31T15:19:05Z,2025-10-31,2025-11-03T00:32:08Z
NEWS: Travel Is Getting COMPLICATED at the Orlando Airport Amid Flight Delays,"All across the country, airlines have been reporting major delays and flight cancellations due to bad weather, staffing shortages, and more. Now, the Orlando Airport has a new statement as the government shutdown continues.
The post NEWS: Travel Is Getting CO…",https://allears.net/2025/10/31/travel-is-getting-complicated-at-the-orlando-airport-amid-flight-delays/,allears.net,Jaden Green,industry,2025-10-31T15:16:01Z,2025-10-31,2025-11-03T00:32:08Z
Air Travel Breakdown Likely As Unpaid ATC And TSA Workers Face Stress,"Sara Nelson, the flight attendant leader credited with a key role in ending the 2019 shutdown, says U.S. air travel could break down in the next few days",https://www.forbes.com/sites/tedreed/2025/10/31/air-travel-breakdown-nears-as-unpaid-atc-and-tsa-workers-face-stress/,Forbes,"Ted Reed, Senior Contributor, 
 Ted Reed, Senior Contributor
 https://www.forbes.com/sites/tedreed/",industry,2025-10-31T15:06:29Z,2025-10-31,2025-11-03T00:32:08Z
"Air India seeks funds from Tata Sons, Singapore Airlines for upgrades","Air India seeks ₹8,000-10,000 crore from Tata Sons and Singapore Airlines for system and service upgrades amid financial challenges.",https://www.thehindubusinessline.com/companies/air-india-seeks-funds-from-tata-sons-singapore-airlines-for-upgrades/article70226424.ece,BusinessLine,Janaki Krishnan & Aneesh Phadnis,industry,2025-10-31T15:02:42Z,2025-10-31,2025-11-03T00:32:08Z
Portugal says planned TAP airline sale has cross-party backing,"{ window.open(this.href, '_blank'); }, 200); return false;""&gt;Why did Apples iPhone sales surge? { window.open(this.href, '_blank'); }, 200); return false;""&gt;How did Amazon boost its stock today? … [+700 chars]",https://biztoc.com/x/971f1bd0c89c7aaa,Biztoc.com,reuters.com,industry,2025-10-31T15:02:10Z,2025-10-31,2025-11-03T00:32:08Z
Bulgaria Seeks Exemption From US Sanctions on Russia's Lukoil - Reports,"MOSCOW (Sputnik) - Bulgaria is exploring the possibility of requesting a waiver from US sanctions on Russian oil giant Lukoil, a newspaper reported, citing sources familiar with the matter.",https://sputnikglobe.com/20251101/bulgaria-seeks-exemption-from-us-sanctions-on-russias-lukoil---reports-1123051223.html,Sputnikglobe.com,Sputnik International,events,2025-11-01T23:27:00Z,2025-11-01,2025-11-03T00:32:10Z
"Assembly elections: As cash transfers emerge as quickest way to victory at hustings, will it work in Bihar?","Cash transfers are revolutionizing benefit delivery in Bihar, with schemes like Mukhyamantri Mahila Rojgar Yojana and revised old age pensions reaching beneficiaries quickly. This direct disbursement contrasts with slower, official-mediated schemes, making po…",https://timesofindia.indiatimes.com/india/assembly-elections-as-cash-transfers-emerge-as-quickest-way-to-victory-at-hustings-will-it-work-in-bihar/articleshow/125027159.cms,The Times of India,Sidhartha,events,2025-11-01T22:43:32Z,2025-11-01,2025-11-03T00:32:10Z
News Wrap: Israel says it received remains from Hamas that don’t belong to hostages,"In our news wrap Saturday, Israel says the remains of three people Hamas handed over don’t belong to any hostages, Ukrainian forces say they destroyed a key fuel pipeline supplying the Russian army, emergency aid is arriving in hurricane-battered Jamaica, two…",https://biztoc.com/x/96e579a1d8400551,Biztoc.com,pbs.org,events,2025-11-01T21:57:38Z,2025-11-01,2025-11-03T00:32:10Z
Balen’s Controversial Post,"Kathmandu Mayor Balen Shah Faces Controversy Over Social Media Post The Kathmandu Metropolitan City Mayor, Balen Shah, has once again found himself at the center of controversy due to his social media activity. Known for expressing his views online, Shah post…",https://nep123.com/balens-controversial-post/,Nep123.com,Editor,events,2025-11-01T19:44:09Z,2025-11-01,2025-11-03T00:32:10Z
Astronomy Picture of the Day- Government shutdown so no APOD Today. I will dig up some of my favorites - An Unusual Mountain on Asteroid Ceres,"Explanation: What created this large mountain on asteroid Ceres? No one is yet sure. As if in anticipation of today being Asteroid Day on Earth, the robotic spacecraft Dawn in orbit around Ceres took the best yet image of an unusually tall mountain on the Ast…",https://freerepublic.com/focus/f-chat/4350068/posts,Freerepublic.com,NASA,events,2025-11-01T19:27:19Z,2025-11-01,2025-11-03T00:32:10Z
