headline,description,link,source,author,query_used,pub_datetime,pub_date,scraped_at
Pilots of Reddit what path do you think is wisest to take?,"I’m a senior in high school coming into an earlish graduation, and I believe I want to pursue aviation as my permanent career. I’ve been told about three methods to become a pilot and I’m seeking insight on wich of these I should pursue. If there are other ways to become a pilot please do share y...",https://reddit.com/r/aviation/comments/1ooobx8/pilots_of_reddit_what_path_do_you_think_is_wisest/,Reddit_aviation,NA,NA,2025-11-05T00:26:47Z,2025-11-05,2025-11-05T11:42:55Z
Aeroflot Plane Stuck in GVA,I’ve been seeing this Aeroflot plane sitting at Geneva Airport for years now. It’s been stuck here since the war in Ukraine started.,https://reddit.com/r/aviation/comments/1ooxact/aeroflot_plane_stuck_in_gva/,Reddit_aviation,NA,NA,2025-11-05T08:15:29Z,2025-11-05,2025-11-05T11:42:55Z
Stunning RAAF F-111 Flight In The Southern Alps | Amazing Air-to-Air Foo...,"Don't think this has been shared yet which is odd for you lot, footage found down the back of a couch yesterday apparently.",https://reddit.com/r/aviation/comments/1ooyoah/stunning_raaf_f111_flight_in_the_southern_alps/,Reddit_aviation,NA,NA,2025-11-05T09:46:45Z,2025-11-05,2025-11-05T11:42:55Z
Cool poster I designed to share a glimpse of my new Korean Air livery design. Aircraft entirely made in 3D with a lot of work on the lighting. Looking forward to sharing the full version with you guys soon. It will be more Korean. Really Korean. Also gave my original logo redesign an upgrade,**Disclaimer:** this is NOT for self-promotion purposes. This is a passion project from which I earn nothing except the satisfaction of expressing my love for Korea through art. I’ve worked hard on this 3D render and wanted to share it with aviation people because I thought you might appreciate t...,https://reddit.com/r/aviation/comments/1oozg95/cool_poster_i_designed_to_share_a_glimpse_of_my/,Reddit_aviation,NA,NA,2025-11-05T10:36:00Z,2025-11-05,2025-11-05T11:42:55Z
Humana beats quarterly profit estimates on higher premiums,NA,https://finance.yahoo.com/news/humana-beats-quarterly-profit-estimates-111415785.html,RSS_yahoo_finance,NA,NA,2025-11-05T11:14:15Z,2025-11-05,2025-11-05T11:42:38Z
Analysis-Futuristic quantum computing stocks take speculators on roller-coaster ride,NA,https://finance.yahoo.com/news/analysis-futuristic-quantum-computing-stocks-110627075.html,RSS_yahoo_finance,NA,NA,2025-11-05T11:06:27Z,2025-11-05,2025-11-05T11:42:38Z
Bybit Pay’s Sri Lanka Launch Could Trigger South Asian Crypto Payment Revolution – Here’s Why,NA,https://finance.yahoo.com/news/bybit-pay-sri-lanka-launch-111753298.html,RSS_yahoo_finance,NA,NA,2025-11-05T11:17:53Z,2025-11-05,2025-11-05T11:42:38Z
Airbus builds towards final destructive tests on Wing of Tomorrow demonstrator - FlightGlobal,Airbus builds towards final destructive tests on Wing of Tomorrow demonstrator&nbsp;&nbsp;FlightGlobal,https://news.google.com/rss/articles/CBMi0gFBVV95cUxNRVFkeWxDNXlTTGRQQmFKeHB4enJZLUF2eHk5aE1xbVdLbkJWSndVdmZQT3JLUVRPM2xnT2FORVBPWlA3eUhKY01wb3VaNkVLMnNqWVhIaVMyT0ZXeVdxN3ZGMmY0RWhlQWlHa3Vrd2tLa3hYcTB4b2FRRm42ZkpUaC01Q2JTN0V5d19JX3VmRjFGODF2bG9OZEtfb0k3RXNBOVJoZzlFZk1XMEpxS2F2NHU4eHRiR3RnbFU5RTJUeHV5VDc4d2Q0ek1EdGg0dmhwVWc?oc=5,RSS_google_boeing,NA,NA,NA,2025-11-05,2025-11-05T11:42:36Z
Boeing may face its first civil trial over payouts to families of victims in Ethiopia crash - PBS,Boeing may face its first civil trial over payouts to families of victims in Ethiopia crash&nbsp;&nbsp;PBS,https://news.google.com/rss/articles/CBMixAFBVV95cUxNZnNQenh5MnhfNUZUWFdiSmdHN2dlU2ljcHd6cm1hWXc2Y2NQV3Rmc1ZvRnRJSWNDLVN3LW1NZFJmbkdybnh6bXdRbUY0Y0N5em1xZURaOC1XMnExX2EyWWstWkltTVZsV1c4VGJTdm9LOW1UT1hFTW5DQkttT2lBTkJBaVlVUGhKb3lLWTZTQ0FfRkNWQ1Zybl9rcjNiaUgyUmplamxnNkVsaTNTS1JCZTVKYVN0WjBDX0JPUUh6NUg4S1h00gHKAUFVX3lxTE95WGwyVF9nTTQ1aEFjZ1dtQ2ZrRUVZWEUxcm1QSHRhbVM2WEhQSXBQX0FwUGZjQXhPdXZGeV85cnlkeWNJVVBFRW4xZTlHNGxDX0ZxdjZ1U3Jydm4zR0Z0NDhnc3ZjaU42T1BEMTllRTBIWmFmSjZtYm1vazVMdWZvU1JodmR0OTJMVjlZeGV4Q0U1TmQ4dzZ3dHBkRGJ2TFF4ME9sZGlzeElpRDRJRTdZWlZ4VGpLMzZ4UDhhWG1vdE5pMlotTGc3N0E?oc=5,RSS_google_boeing,NA,NA,NA,2025-11-05,2025-11-05T11:42:36Z
"Turkish Airlines to meet Boeing, CFM in coming weeks, chairman says - Reuters","Turkish Airlines to meet Boeing, CFM in coming weeks, chairman says&nbsp;&nbsp;Reuters",https://news.google.com/rss/articles/CBMiswFBVV95cUxNNTY1anpjNUhZZmVMaDBHbVNMNUlCdnVSR05JYWVBSG1PcmpBTy1yanAzMktpYTY1Z1RLWWdFYU9FRHFUeGpRMlljTHZFOVRaYWE5cFpkbmVObi1iand4NGpVOHZiT3ZGeGFCV3FUSG96VTIzTHh1VklVUEg2OXJIV2tsRzM2YWFGNGRpMUpOTVc3ZU9rT2VtSEhwcnQ3X2hMaURGWnN5V1BuY0QzR3U1QVFSVQ?oc=5,RSS_google_boeing,NA,NA,NA,2025-11-05,2025-11-05T11:42:36Z
Airbus Said to Deliver 78 Aircraft in October Amid Supply Woes - Bloomberg,Airbus Said to Deliver 78 Aircraft in October Amid Supply Woes&nbsp;&nbsp;Bloomberg,https://news.google.com/rss/articles/CBMiswFBVV95cUxOVnJJNFU0X0J4OXhCTlJzN1htMFFPdm9UaW83ZXpaaU1iZVY3RXpWNG00YUZmUFJaMzRxNzdtUkd6ekZqcEpUMzdvTWFYR19SVE1lNjI0YXhhQjcxdUxzSHYwcndWd3MzRHJOZWtTZElENnQ3UEpyR3c2aXdzaHpEcnU3ZG5nUTgxYXlJUHVNcWpYMkZsUFhxZFhLS1lrc05aWDB5cWFxUXZHQ0xVd3hEVG5hZw?oc=5,RSS_google_boeing,NA,NA,NA,2025-11-05,2025-11-05T11:42:36Z
"Turkish Airlines to meet Boeing, CFM in coming weeks, chairman says - TradingView","Turkish Airlines to meet Boeing, CFM in coming weeks, chairman says&nbsp;&nbsp;TradingView",https://news.google.com/rss/articles/CBMi0AFBVV95cUxObWxiWlNFeGxwRmZrMmRpZG1xRHNWNlllUEZPNXRnd0REMEp4NFIxNEhyMzRKZkZ0Yk14QmlWbjVsajROdkpuZmZVRHg2dXhjb3hJY25YN2U0RWg1UHdNdHc3SnZYaTUxR3U0VjJRLWFCVU5MNGlWZnNiaXNYVHJZR2VSUTNtemZ5T01BenJnZF9Vbi1nb0tOQVl2MVVadDhfNkZNWXpPMHhpUHlwWlJjTWRSQzFYY3BYR1RrM0NzdE9OUElDUlVMOHUyVDdnVjJm?oc=5,RSS_google_boeing,NA,NA,NA,2025-11-05,2025-11-05T11:42:36Z
Jury selected in US trial against Boeing over 737 MAX crash - The Standard (HK),Jury selected in US trial against Boeing over 737 MAX crash&nbsp;&nbsp;The Standard (HK),https://news.google.com/rss/articles/CBMitwFBVV95cUxPZTZxb3NPTXBBcldCM051b3U5Y19RVzJQempuci1HMXJsVUpiNUhlWHlLdGZKVXBSQjlUN0VlYUNUWjE3UWtXVEszeE9iQ1NzcmUwd0ZFS0UtSXlMMDhaQXhHemhydDhJNDJRRjV5bUQ4OXBHWHJQYXVEYk8tWTI3cnd0M25UbldIU2Myd21vTG5oSzVVamYtT0ZZZVF6dFV3T0RuZEhLS3BKQ3IweXpmakR2SGtBWUU?oc=5,RSS_google_boeing,NA,NA,NA,2025-11-05,2025-11-05T11:42:36Z
Turkish Airlines to meet with Boeing and CFM engine maker in coming weeks - TradingView,Turkish Airlines to meet with Boeing and CFM engine maker in coming weeks&nbsp;&nbsp;TradingView,https://news.google.com/rss/articles/CBMi2wFBVV95cUxQWGV4bzZpYWRHWUFwUHlXSXpybklZOERFQ1BGVUk2alRXX2tvZzFGYVl0eTVjWFZ2TXpiX1ZYSmJkdm5nNkFQd0FIYk9lR0M5OURtNDA5ZnkxR09LazZCa2RrTXRTQTJ0cDVQbzBZWXAtOTh6Y2JMQTEzUHducFJXSENsRzNZWUh2bXBHY3dXNURZblZ2cUN5Wi1tWVYwaEVHdEkzQ0JkdzlXZDNKc0QwQzFnWEdja3BjeUZzY0lJaGYtb1pvbTRPQU1hbkhJSkpCbFBBUUtaSmZmYnM?oc=5,RSS_google_boeing,NA,NA,NA,2025-11-05,2025-11-05T11:42:36Z
"Turkish Airlines to meet Boeing, CFM in coming weeks, chairman says - MarketScreener","Turkish Airlines to meet Boeing, CFM in coming weeks, chairman says&nbsp;&nbsp;MarketScreener",https://news.google.com/rss/articles/CBMiugFBVV95cUxOMk0tNk5tTThvNFZwMXEzRExsZURmcjVzSEFUTmVPQVV1MHVrcEpQX2NldGZtamxwV1QtZjZUOUNSVy1MNFZvVzhFSklUS0VNeTE3VzVjVFNYcjhDVmVIcXRvV003S25VLVpwbjlXTjFfR2Q4bTdaRnRrTUJUYjRZLWFtdHBFWUpXMGFSRFZ3YmVxSFVfeTRyOE1GMzBtbDRKODNQUmF5LXR2R3FmMnZYNnlzS2ZwUC1Mc2c?oc=5,RSS_google_boeing,NA,NA,NA,2025-11-05,2025-11-05T11:42:36Z
Airbus A320 ousts Boeing 737 as most-delivered jet in history - CNA,Airbus A320 ousts Boeing 737 as most-delivered jet in history&nbsp;&nbsp;CNA,https://news.google.com/rss/articles/CBMimwFBVV95cUxQMmpad09DMHhFRThVbHhPbDhDdzNheXRxNHp1dWN5QXRFUEZhV3FYVzFnYTlhTmVKYldqRDRGZUxIRFpSSHNGT2JzOXRKSERuTkZSZEZONThtUHpsTjg3T09ERXRPaTNlRmhDSnJnS04wQ2t3SV9jcWhvQldETzJBcmhsSHQ5aE1qRzJiSFlPcmdiZzRBZ2FmcmV4MA?oc=5,RSS_google_boeing,NA,NA,NA,2025-11-05,2025-11-05T11:42:36Z
Malaysia Aviation Group orders 20 more Airbus A330neo widebodies - Airbus,Malaysia Aviation Group orders 20 more Airbus A330neo widebodies&nbsp;&nbsp;Airbus,https://news.google.com/rss/articles/CBMivwFBVV95cUxOcmtZS1U5OERRQ2JYci15Qll6M1hncWcwOGVqb3dYZ0ozQy0tcmFKMHRIUmlHWDVIRENaQUNsb0g3NUFkSXN3UTA1d2I0Z0N3WmRvVlpkSWF1cFJsS0ZUWWMxcEU1T3JtV1VmVTdVS1dwc2NaZGZUUFVDaE94NUxmMVZCQ0pHeTFYWkdFYTRlaWc1a1FBaFh0em1LdXg1LVRrY2JEQUIyOU5jMFhuZEhHNEVXUHVKRWJtT2NVMWNGMA?oc=5,RSS_google_boeing,NA,NA,NA,2025-11-05,2025-11-05T11:42:36Z
Seven wonders of the A330neo - Airbus Aircraft,Seven wonders of the A330neo&nbsp;&nbsp;Airbus Aircraft,https://news.google.com/rss/articles/CBMijwFBVV95cUxONWJ4V3NTMXQ0ejctWGZQdTI3ZWdNcVVZVkxTWk1TOFJOT0lFUWphbTFqX0tESFhoU1VJQm1Qb3JqTXEwMHFvYjVMRlJ2LWNLb0laRi1yT29NMTlrU1ZOZFN1Z2E5dHU4bXlpX1o1cVVRTUp3MlBwZ3NvalRYNTVWb2JzR2JrdnBHMzVZeG16NA?oc=5,RSS_google_boeing,NA,NA,NA,2025-11-05,2025-11-05T11:42:36Z
Boeing’s Rebound after the Industrial Freefall - AeroMorning.com,Boeing’s Rebound after the Industrial Freefall&nbsp;&nbsp;AeroMorning.com,https://news.google.com/rss/articles/CBMifkFVX3lxTFBmODJMU3lpOVJsNlVjaFJ5ZlZPcjUtd3lzeU9UZVBiWlBuZzR5SVZ3M1dPV25zUFFGWHpzUUZvSzFETVlURHRfUFFkTGJOYjdEQzlYdXpuc0hWWktNN0pHMDhuYm9kaExRSGpWbWtORXJQeGhBdG9CMGJwcFhCQQ?oc=5,RSS_google_boeing,NA,NA,NA,2025-11-05,2025-11-05T11:42:36Z
The Future of Air Travel? Passengers Want Mobile and Biometric Journeys - FTN news,The Future of Air Travel? Passengers Want Mobile and Biometric Journeys&nbsp;&nbsp;FTN news,https://news.google.com/rss/articles/CBMitAFBVV95cUxQdTRNeEt0ZGtVei1UMUhvSndPeC1rdWxuWHVZMWhUS3RtZ2ZyMVVYS0JfTFNodlRVMi1LQVZfaVhUNFo4ajAxSXZEZEl1YWltODgxSENYLVlITDZRX0kwQURGa1YweUFURE1RM2R6Ukl4am52LWhEa2ZqWkRzX2lMakZmOFZueXRVQzM0OUtjRUNERjVscHZDZExLN05uVUVWMkIwOW9RdnlibzJUN1NfVFI3YW0?oc=5,RSS_google_travel,NA,NA,NA,2025-11-05,2025-11-05T11:42:33Z
Flight delay data is already flashing red as the government shutdown drags on. Will your holiday air travel be affected? - Business Insider,Flight delay data is already flashing red as the government shutdown drags on. Will your holiday air travel be affected?&nbsp;&nbsp;Business Insider,https://news.google.com/rss/articles/CBMiwwFBVV95cUxNTDcxVU1KVHg3Mmt4d0NISno2bHh5UngzNkVkcE1RUXRIbFJ5cm54RjNwdjRwX2ZaRzBtT1JJVGU5TkpQR0VramtOaV9kVGk2a2tCdERkNTdWVHEwbHcyaWtETUI5QlNBVTJEaTQxTDE2eFlIeDR3LThTYi1URDBocEdYd2FaZ0dvcDZRVG5SNXk2YnVLUDd6MG5feG1qVmFPQmRTUG9vTXUzQ216MVd3SEN4YUVZUzlqLVN3aUNUUWx6TWc?oc=5,RSS_google_travel,NA,NA,NA,2025-11-05,2025-11-05T11:42:33Z
"Travel Crisis Hits Chinese Skies as Eastern, Shenzhen Airlines, Air China, and China Southern Airlines face 72 cancellations and 913 delays, Stranding Passengers in Dehong, Penglai, Shanghai, Nanchang, Hangzhou, Chengdu, Harbin, and Other Destinati - Travel And Tour World","Travel Crisis Hits Chinese Skies as Eastern, Shenzhen Airlines, Air China, and China Southern Airlines face 72 cancellations and 913 delays, Stranding Passengers in Dehong, Penglai, Shanghai, Nanchang, Hangzhou, Chengdu, Harbin, and Other Destinati&nbsp;&nbsp;Travel And Tour World",https://news.google.com/rss/articles/CBMi6AJBVV95cUxQYVJEMDJmTWlNMkNRMGh4NEpqTWZRWU91cWlFZ3F2MW1yUGd6V3R4WlZxUjhCSVVwbExBUU1VTHcxM3Y3RGVEOEt2WEFFSkdKQXk3bWFTTXlGTUxpQmFxR29zUjQ4WEtaS0VOUk9CajAtaERSN194VW5qbDdKdmRzWjA2aTFGUGhvZTE4T2ljRk5sU3VOaHhuejRpMEZRTnlmZGh4Rk9DOV92SDNFS3FQWU51OEFmYV94WmMxRzdRRVZ0SkxZQjVYeUdFVEhNUDJIcm9kYm5UcDZiaWpkT3pkd1NGWG5PcDE2emlMOTVpRkR6cGpHNEU1V0V2Yzd0ZWJIR3dMNERmR2ZlUnNGaXdIV21ZWXc0WkhwU2NxZ2JsZVVvSEtYcnF4c1hHaXliVTh0aHB0UTFpd2hkSkVfeXpCT1gxSGg5RUFaNkx4dDU2WDU2R05RNzJtTU1SM3RIUjEyQlgzQzhGLXA?oc=5,RSS_google_travel,NA,NA,NA,2025-11-05,2025-11-05T11:42:33Z
Korean Air Takes Flight with A350F: New Era of Eco-Friendly and Efficient Cargo Transport Unveiled - Retail News Asia,Korean Air Takes Flight with A350F: New Era of Eco-Friendly and Efficient Cargo Transport Unveiled&nbsp;&nbsp;Retail News Asia,https://news.google.com/rss/articles/CBMixAFBVV95cUxPR0NEMEU0ZmFfZnRrXzhYMlRDMHk4eEx3cEJTT2hrYmpMZVZOcjQyeGtKbUczM2RBakV2Rl9aR2lEaktwSUxQYkhQRVg3OHpsOUFkcDVCdFlLM0lWei04dDJ3aXVwTTVPbUd4VDRVYkh6VkI5QmoyV09FeWhyVW9EMGFWdlV6RmZrVXlQLXBIc2F3dVpIQWdyUzl6eDlhaXF0M3dzN2JOUm9nRHpSM3dBTHNpVnFGcFUtSHdLYkV5MDVQM0JW?oc=5,RSS_google_travel,NA,NA,NA,2025-11-05,2025-11-05T11:42:33Z
Air New Zealand’s Groundbreaking Bunk Beds and Skycouch Set to Revolutionize Long Flights to the UK - Travel And Tour World,Air New Zealand’s Groundbreaking Bunk Beds and Skycouch Set to Revolutionize Long Flights to the UK&nbsp;&nbsp;Travel And Tour World,https://news.google.com/rss/articles/CBMi4AFBVV95cUxQTm8zanczeXhZMnRLWWtPRUhMdzRxY0NTYkFHNkxlczBxQ1BFMDZjRG9aN1JyYjRxOHN6T05VRkhla2VNRGJxWkIxQ1FCenFtQ09yS1RUdzdMSV9FeVQ3ejVsS25aNnlQY3RGZjJoT1R2eEh1alpRZUw5VE56NFhKTzUtdmdfUFIxakVmZXl6Y2YtS1B4emJYRF85SXdLd242ZHNnSTQ0RzY4emhreGNFQTZKTk43LW9VdWN0VEU2b3RsZUo3S3RGcmJ0c0R6dGJvTG0xOTFLa0VrZXZhdTZRbg?oc=5,RSS_google_travel,NA,NA,NA,2025-11-05,2025-11-05T11:42:33Z
IndiGo Says Delhi Flight Operations Hit After Air Traffic Congestion - NDTV,IndiGo Says Delhi Flight Operations Hit After Air Traffic Congestion&nbsp;&nbsp;NDTV,https://news.google.com/rss/articles/CBMirAFBVV95cUxQUVVHalhhVXVqTFFIY196XzV3QlRkWUxsM1FxTERwaGRTaVJ5Rmc2ejVoM29wa2NmUEJJZjM3MjRpVzA2WENFVmZyVk01d1pyaW50OEZVUDdPNGJhcWRrUGYwQ1p0Y1VaWTIteUx1SFA5WXpZc1g4SUYzZnhSVTJHdVhmRzRKaTkwU25zZXBEVE55WlpTRnczemFFT2RlZEU4N3ZaTEtPajI5LWVp0gG0AUFVX3lxTE1NdGh5aVB0UUhxMHMyZjg5WDZmZ2hxMDZMeGQ5MVpGMDBtbTIwVVhBMU5yY1lkX0ozY1VnVlFXaGNwV3NLSzFjRFRWUWdCRU9yb05MbjdmNE1yNDZ5YXdNZ05LSmFya3Z6N3FacEN4enFRNkFlRDhQWjhuRDVZakRzaHpNM29aWHVTcGM5ZERCTWRLVDBuSkctUXJYcFNpd2RDNTl3bEFfaVM3U0ZoQlU5eXNJUw?oc=5,RSS_google_travel,NA,NA,NA,2025-11-05,2025-11-05T11:42:33Z
"Air France Launches New Travel Route: Paris to Phuket, a Dream Destination - Travel And Tour World","Air France Launches New Travel Route: Paris to Phuket, a Dream Destination&nbsp;&nbsp;Travel And Tour World",https://news.google.com/rss/articles/CBMivgFBVV95cUxPUi1WOV9iOGtIVUVPdWxLSnRNUjhKYjdLTlBhN1dBay1GcFAzQzR3WkNMaFBuNmhXN1FKUzdlTzlnVFZaUjBlTzQwTWs3ZERJNXRuWXg3SVNENkFfY2x2RVBPc05XdU1taXo4cTE1TVM4MnY0VnRvZkhINnhZMXE1MmEyRG4wRWRfZ085aXJVSFVZM29tMTctZnQtQVVSeXNGRzJaWGpGb190b0ZiaUZuU1poT1YwWDJ0ZG5OWVRn?oc=5,RSS_google_travel,NA,NA,NA,2025-11-05,2025-11-05T11:42:33Z
Air Algerie and easyJet Revolutionize European Travel with Bold New Routes to Budapest and Berlin – Don’t Miss These Game-Changing Connections! - Travel And Tour World,Air Algerie and easyJet Revolutionize European Travel with Bold New Routes to Budapest and Berlin – Don’t Miss These Game-Changing Connections!&nbsp;&nbsp;Travel And Tour World,https://news.google.com/rss/articles/CBMilwJBVV95cUxQdk9ZLWxMR1c3TEVtM2wzdUF4Wl9pbEtFNHpyVWMzY3hxRnM5WnllTkp2NmlqMzhlbDM5aXl6ZFIwU1VzMXNZZmRjVHk2QVRBTllYQ092M2wxVlNLajNGOFo2QUE0MHJmQkNQaWVsVnNFQ2JfRXBrR1JuT3hZbzRyM042a29ocTRkel96OGxuVXlTNThaUV9mblZrU2d6TXlvWEJuemllTmZxU0k1SFFlVWx6R1V6ajREaDY5TERiRTV4YmNSMExsTnd2bUpXM2pkNl9nN2NyQ05VUDRwckZVUUtwekI5bDVsMEtJZmFOazNDV2NlQ05qeUpNREp2dGIxX09xWjYyUFhEMUp1cmJxaFVabm93Szg?oc=5,RSS_google_travel,NA,NA,NA,2025-11-05,2025-11-05T11:42:33Z
"British Joins Ryanair, Air France, KLM, Vueling, Turkish and Others in Skyrocketing Tourism Across UK, Italy, France, Netherlands, Spain, Turkey and More With New Flight Routes Across Europe: Everything You Need To Know - Travel And Tour World","British Joins Ryanair, Air France, KLM, Vueling, Turkish and Others in Skyrocketing Tourism Across UK, Italy, France, Netherlands, Spain, Turkey and More With New Flight Routes Across Europe: Everything You Need To Know&nbsp;&nbsp;Travel And Tour World",https://news.google.com/rss/articles/CBMi2wJBVV95cUxOS1h2NnVwb0FiX3NLTS1LWVJLRnBGc3dyVV94RDN0NEZ3Y3kwM1VfaFoyWVZwMGxEXy03aDRCWWRJbUxDc2FWdGc3OThSeDhJRVZZNXAtT3Z0NmtOU2pKN21ycHp1RHpwVkFmZkVxSGdpRDVuQ0xTTFJUeWRnU0d1OEZxQUNFRENfaDZJYVNGOG8xV0VGVUt6XzUyQ2RzVUMwRGRMRGxJVWNWRU5paGRQcHVrc0o1SERKelg3ZmxtQ2FydGIwNy1seXNnb2JzT2ZUUDBJV2ZnSVhNc3pGdTVDWkZDTDQySnpONHFnSE01cGQ2dEZYbGl6MkpCa2F3T2I5LTRjZ2hJUFJYT2l3dXpVa3NTNDJLNUpkeWRJZXBQUmhkTWZBNUd6LUx1bkFtX0hxM1ROLWtNLVdzMnNtalZsUGZPVVBrdHBqSUNDcVNiaTF1bVpJeWF6OEYtOA?oc=5,RSS_google_travel,NA,NA,NA,2025-11-05,2025-11-05T11:42:33Z
"A Transavia Flight TVF28MQ en route from Paris to Lanzarote Makes An Emergency Landing at Biarritz, France: What’s The Shocking Reason Behind Such Mid-Air Chaos? - Travel And Tour World","A Transavia Flight TVF28MQ en route from Paris to Lanzarote Makes An Emergency Landing at Biarritz, France: What’s The Shocking Reason Behind Such Mid-Air Chaos?&nbsp;&nbsp;Travel And Tour World",https://news.google.com/rss/articles/CBMirwJBVV95cUxPb2dxa1JJUmwxQzI2N3BmYWVnNGNaeGw5UklHLTR1ZlhLOVAtVERCR0kxcVRxc2RSLURPa296OHJtSGJibzdLSk12V2hWM1d2MUJwTFN5UGRteUVieEVsdVZlVUlWTTJwMERiaEhjM1QySF92RElNTXM0WFhYc25Lemh5cXc4WWVsWFgzT0I4OEl0RTNUVjlWaDFKM0pMaFBxOUlhQ0tSMHA2QnhhaFhEMV9JOTBKWDRiQ19QYzhJdzBvRXFFZGpYUVQ4SzV6aks2VTVsMnFCLXVHWXhWTk9rSFNZSWQ1Q2VlbHVRbXVTU01qdkF3MlR6OU1wS21Cd2ZfLXZVSjNIY2ZyWG91S25LZWh6UDF1SWRYRTRoSTVMaEdJTmtCb2w2QmJEbUY0b1E?oc=5,RSS_google_travel,NA,NA,NA,2025-11-05,2025-11-05T11:42:33Z
Free flight cancellations within 48 hours likely in regulatory reforms - Business Standard,Free flight cancellations within 48 hours likely in regulatory reforms&nbsp;&nbsp;Business Standard,https://news.google.com/rss/articles/CBMi4wFBVV95cUxQdmdWM0tXN2ZmSWNFQW1TVlhxQVdvSDdfTlVuM2FtR3N5WkxfbFV2c0JmU1o4UHFwMXNkeWtDX0RVRWVQUkhQVy1lU2t5YWNKaU5UbEphYzgzSjBlOUNrRV93RlJjVWZ4MlV3d3JLVVBXMXU5cFcwbW9nVUR1WTJlalFPSnVheXA4bmdjc010ckRCeUN1N1VTSGQ0Zmo4aVBGeUxfcHdCRFRuQWYyQkxCeEZ1aURWVmRmUGN0RHdjanFVdkVzZmFFRExDSHlienQ4V0VFa3Vpa0Z6NjUtSFVEbEpzSdIB6AFBVV95cUxPM3ZUdUtfaWg0V195Q1dta19yLVR3Rk9MTHo5Z1ZDYTNVMEVRTGhRM2JPYUxHMVBqRFZjbWtlZUpodnJReTNnMi1tMHJudWFqSTlmdUxIV0M3U21PSVdwSlpCOVliUEJBbF9vT1EtbndoRmtqN19ickR0dXdka2ZGemdlejI3dkRsaWVhWHdsalcwQ1E1c3VUYnFkTExyb2pPei1mMFhwQ18wRmZvRmhaNU1WaFVvd1VCbE1VTE9tVjV5V2NfVzhZY3I2dHVmZk9kM2tWbW9RLVByWUlqQ3ZaY3lrSW5aR2JN?oc=5,RSS_google_travel,NA,NA,NA,2025-11-05,2025-11-05T11:42:33Z
US government shutdown triggers air travel chaos as flights canceled - Yeni Safak English,US government shutdown triggers air travel chaos as flights canceled&nbsp;&nbsp;Yeni Safak English,https://news.google.com/rss/articles/CBMilAFBVV95cUxQZFYxOEJsVHFoWm51djNUdGxYUF8zaGFSQjVycHlWMlpuTmhCeUs0WEZrb0xDQlo4d2MxclN6WlFyZ1VoSnJrUkVzcTQyeWFMUVBrQlFjT0dVQk1zVnF3TjB4b1ZQVGNucHd3RjQ3Y1d1ZkNrSnRaU3Fkc1U0RzdhWGhfUlpueV9KT3h4WlJqOUlYMUxV?oc=5,RSS_google_travel,NA,NA,NA,2025-11-05,2025-11-05T11:42:33Z
Air India SFO–Delhi flight diversion: 228 passengers stranded in Mongolia’s Ulaanbaatar flown to Delhi - The Hindu,Air India SFO–Delhi flight diversion: 228 passengers stranded in Mongolia’s Ulaanbaatar flown to Delhi&nbsp;&nbsp;The Hindu,https://news.google.com/rss/articles/CBMi1AFBVV95cUxOTEQ5Z0MxTG1oMGFib0tDZjlVdHA5NFhqMkMyZzNxOTFReEpYUE9RTDJjU0VTd2pHSzZYRHluY1JvbHpyX1BHV2JCQVc4Vnp0V2dwQlNHRW9FYXRLMGhsRHp3b3BaMW5SNGo4R0JBeXlPMnVNMHQwcE1FWllpNnVqUkF6VlNnbjRXNkJKZ054NDBlX0NFWkZtMEFWUmllMVRFYURUWnFZLThEOUp5S3ZiZ0pJanhGblgtVEtBTzFVOVhhOENvWXRGSVVRRE93UXVoUC1DWtIB2wFBVV95cUxNUE9UZW9wcDVnbzZQbkVPbnMwbktHOGkxcXlTakJtbDEtZlRvZDhOTWZaanROazNhTkhKLW1EQUlfb2lNeEVIZW1wXzlVSC1SdGJTa1hKS3M4aTVsdXdkRUQtWkpFaGxJbEFPdmZmZzRxTjVDT2VfMnNkOVlRWmFnbU1SY0tiaTR4Q2NWMVlCQ3VGMHZsN1AtM3JDMlNhblF3WDVCNWx0TWZrc3ZMMU1hZXNJNXJiZlpfMmp2ajBCMElMeVpLeUhCZmNxWWdGdHJpcVpHX1dlNUkxcWM?oc=5,RSS_google_travel,NA,NA,NA,2025-11-05,2025-11-05T11:42:33Z
"Air Arabia operates first flight between Ras Al Khaimah, Kazan - TradingView","Air Arabia operates first flight between Ras Al Khaimah, Kazan&nbsp;&nbsp;TradingView",https://news.google.com/rss/articles/CBMi0wFBVV95cUxOSVpibHBHRURsa0VjaUw2Q09YZl90bVNuQUd6R1lROERQLVlqaUNvT2d2RTNWNVZDS3VKUUo1UDl2aW94aFJ0ZG9SV2REMkxMOWstQU9Ra1lUeV9ucncwbXJvdXpMMXc2YlFPb0t4QWdRcE5uRW1fTHpHQ185NmZ1Uk9ZN2dBal9oaEN5ME9SamltN2tjSjB2YmVuS2JTbW8wYTdtSnh2UGx6dlgtcUhJX1pmUHNtSExDTC0yTk9IUVo5N0x6WFlESUY5NVFaQ0UyOGM0?oc=5,RSS_google_travel,NA,NA,NA,2025-11-05,2025-11-05T11:42:33Z
Qatar Airways and Air Algérie Announce Codeshare Partnership - Travel Radar,Qatar Airways and Air Algérie Announce Codeshare Partnership&nbsp;&nbsp;Travel Radar,https://news.google.com/rss/articles/CBMijwFBVV95cUxPZmVGS2FiS3BIVldFN2ZlUW8zdFRvTFhvRkJLalFpZkYyM0lQczY1WnNiWVhsR2FGb05PNmFsNVVoWG14eU1oRXRReUtHUE5GbjJkWUxqQkNEMS1aNXNFc2lqVEFXZy1nb0pjek5maGVRWV9GM1pYdVg3OUdCRWhyUnd1a1lZWHVjQzNMeVdoZw?oc=5,RSS_google_travel,NA,NA,NA,2025-11-05,2025-11-05T11:42:33Z
"Travel Chaos Unfolds in Europe, Including Belgium, Italy, Sweden, Germany, Spain, France, Denmark, Netherlands, UK, and More as Brussels Airlines, Air France, KLM, Air Algerie, and United Face 51 Cancellations and 117 Delays, Leaving Passengers Stuc - Travel And Tour World","Travel Chaos Unfolds in Europe, Including Belgium, Italy, Sweden, Germany, Spain, France, Denmark, Netherlands, UK, and More as Brussels Airlines, Air France, KLM, Air Algerie, and United Face 51 Cancellations and 117 Delays, Leaving Passengers Stuc&nbsp;&nbsp;Travel And Tour World",https://news.google.com/rss/articles/CBMi5wJBVV95cUxNMFN2Yk9pT2lWVVVOV2l4YjhsMm9obkFpaTRUNzkxU1YzUzFpTkY0aVdHRmFOMU8xa1Z4dUFMSENDTHBzVXFFZTQ3MkJDd3NYeVlELS1hQXplSkIxR0hmODg1TlpZTnp6SWJaQnRUcG1ZOXZBaDJfUTVyb2x0RVBGMlk4cS1NSHIxYUZHVlljZ0dnT2ZJc0hQVndBUEdIVFdUOUtVLWRMMXBuSHNodm9CZ1ZwbER1Wmd3aEpWZFNFc1d6SDlVcXhzODRteGpaeVg4WnYxVzQ2SnZiSVlwNGZudE1mM3V0SEtWYmFJbWtsODQ4WFJBYkRaejV4M0VadzVySkhCM2IxU2dLb2phZnJnU1QxVTFjREFsd3FGZTdJTU11WVFnLWpIOC1vbG9kV0xXLTRpSUZPUkZRMHF2N0dtT2NlWk9Oc3NmZXl3MjRjVDlQZ3gtSHNxRXBYTVU4SkowODhXN0NyYw?oc=5,RSS_google_travel,NA,NA,NA,2025-11-05,2025-11-05T11:42:33Z
IATA’s 2025 Global Passenger Survey highlights mobile and digital ID as the future of air travel - Travel Daily News International,IATA’s 2025 Global Passenger Survey highlights mobile and digital ID as the future of air travel&nbsp;&nbsp;Travel Daily News International,https://news.google.com/rss/articles/CBMi3wFBVV95cUxPeDhLOGtDNkxfT0VDckFIYmFnNHRlVHpoWUxOSUNzbjhQUnNsM3ZScl9sczF2UEhUTDRORzZiNFJpTDJkTnJLMXdTblkwNlpSOEkxSDAzZ0xnM213SWRVTXdxZnZZaXRSdFc5d08zNEQ2bFR3Wlh1U1BGXzZSQVc3QkNIWmNxeTdHWDNtM1FXdmNxU0ZkQ2hZM1NTOXlNM05sSFVidk5UVjVnTnN1Qk5yZ2IwM0hxcXpkMGRaQzl1Vks1YkNWT1U4b3M0djVIQjAtZ1ZaTE9Md3BKRF9iU2pV?oc=5,RSS_google_travel,NA,NA,NA,2025-11-05,2025-11-05T11:42:33Z
"Royal Air Maroc’s Major Fleet Upgrade to Boost Travel Between Morocco, Europe, and the Americas, Starting in 2028 with Casablanca as Key Hub – Here’s What You Should Know About Morocco’s Aviation Future - Travel And Tour World","Royal Air Maroc’s Major Fleet Upgrade to Boost Travel Between Morocco, Europe, and the Americas, Starting in 2028 with Casablanca as Key Hub – Here’s What You Should Know About Morocco’s Aviation Future&nbsp;&nbsp;Travel And Tour World",https://news.google.com/rss/articles/CBMi0AJBVV95cUxNUWlEb1IyYnJmMzZFcGN6d0h1WmhMN3pKd2l3Mlh0M0JNQThUbkszUlJiUUE5Qy1MMjZmZDdLSnFrRXUtcU4xTWpnYVJKdkhMdVpKVXlwSFZIM01QbmQ4cUFuNHIyUS1kajRCenFsUlRYZTlZZVMycXhIdWFXVjd3ajlhN29fWFp4aVpnaXAybEllc3E0T3AzRlNMblIyMlJLWnNSNklZQ0h3SHF4OFI2QlB6UHM5SWRTeVRXdURMZ0kzdjU5d0RDUEJfTnRyalhtYUhKc1dtWjVEQk9tWnRfMzZIM3VTc1VjQUZqMmlod09iNzJqaDE5UUx1Q3RiTXlwbW5GQWY1STliWjBOOVBBc3dkSlR3cWhmekxWSXBJN3h1VlFkRmtJMFJjU1QyRjg5Zlp0MjNQb3VOeW1zT3I2dWNNVmVyMC04WVdMSUdSNjc?oc=5,RSS_google_travel,NA,NA,NA,2025-11-05,2025-11-05T11:42:33Z
Wizz Air Earns Top IATA Security Certification - Travel Radar,Wizz Air Earns Top IATA Security Certification&nbsp;&nbsp;Travel Radar,https://news.google.com/rss/articles/CBMifEFVX3lxTE0zNFFuSUN5YVlvWGJoeVMwN1ZESXdzN0ZGcmk3X0Y5Z1RjVms0b0NSMUNORGZ1N0lLdUUtNVp4SzFqT190UUZaM0FodHJRU2Y1X2dOV1lyWlNDaGx5VnNvbEo0MXFiTmg5Sm1OQmFKLVdpd1QyNnFOdk9kUFE?oc=5,RSS_google_travel,NA,NA,NA,2025-11-05,2025-11-05T11:42:33Z
Revealed: Singapore Airlines’ new SilverKris First Class Lounge at Changi Terminal 2 - The MileLion,Revealed: Singapore Airlines’ new SilverKris First Class Lounge at Changi Terminal 2&nbsp;&nbsp;The MileLion,https://news.google.com/rss/articles/CBMitgFBVV95cUxPaGw3RTdhcVZ6V3F5cEEyQXkyQmRBcHQ1elJvVFQ5SUljU0JXWmxuY0Z2amxPNG0tNXRyWWlhNmt5LUxZWlhWWThwZFBSSHMyYXEyeVhKRWRvaDlzaU9rY3FUOC1PaWhEaHdGY2NoRm5ZbzZyXzZwdTVfbzFZaE44Sl95RS1fclpHbW9XU2lDRmxlZU52SVYxRktURk1lcklDbVNqZDdDc3BoVlZ6bEVySXZLaVFsZw?oc=5,RSS_google_sia,NA,NA,NA,2025-11-05,2025-11-05T11:42:29Z
Singapore Airlines reveals all-new First Class SilverKris Lounge at Changi T2 - Mainly Miles,Singapore Airlines reveals all-new First Class SilverKris Lounge at Changi T2&nbsp;&nbsp;Mainly Miles,https://news.google.com/rss/articles/CBMiswFBVV95cUxPUm5RUEZnU1VscXVCYUlSWWlPQjBjM0ZBQVlzLWJIUURHTlpjS2RvRm5LYm5lYzZIY0s2VU10Mml0cHlvVDVkTFJvMFRWeTZkVHJJaE13a2JYMGcyd1NLUnYxblN4UFZTX0VPM3M5ZTRGV3BzbVd0QVFva2ZLRWdVdkphRW5WOGc2a25KbzhtQ1BOWHQ3QVpRTXNkYUZVaXktU3VlaDRMTG9nWG5jbHB5djdjZw?oc=5,RSS_google_sia,NA,NA,NA,2025-11-05,2025-11-05T11:42:29Z
Sneak peek at SIA’s new First Class lounge in Changi Airport T2; Melbourne lounge to be revamped - The Business Times,Sneak peek at SIA’s new First Class lounge in Changi Airport T2; Melbourne lounge to be revamped&nbsp;&nbsp;The Business Times,https://news.google.com/rss/articles/CBMi2AFBVV95cUxQbHlpTko0R293MFRaM3pORkpvV0JUeHY4Ul9uTVBNcERMZF91aE5FZ1lId29kMDZEX1ZaaXFrVjdPVDdON1RXbXJzdWoxWU1ORlU4bmMtNjRxRTFrX2RfX3VWVUlzeHVHQzlfUldMWFFBMm9wSlVyeTRrSU1xdEZQOUpYdTNxMUtuTVU5Y0JwbU91TmgyR3NYZkZ1RzMtRHROUWpQY2JOVGE5dXhXdUxEVG9mMnlwSVRTc3J6Q0YwTm81Z2dOeXZuQjktV1lSRXZKd2hFM0xaYS0?oc=5,RSS_google_sia,NA,NA,NA,2025-11-05,2025-11-05T11:42:29Z
Singapore Airlines opens new Changi T2 First Class Lounge - Executive Traveller,Singapore Airlines opens new Changi T2 First Class Lounge&nbsp;&nbsp;Executive Traveller,https://news.google.com/rss/articles/CBMilgFBVV95cUxOT1cxeXhpa3poWW1oRFVRd2xVX0o3bXpPUkZfU2xyNjQ3WllGNHdjYTAybHZwRXp4cFoxeTE5VVVtM2s5aG5EZGF6Nnd6ZTZYMmJWTjEwamRWS1hVeU5NeTh2ZFZLLUt3NFp0dU9scGxJdEhKeG9NdmhEM0x2MjBFRDJxRGhweDFnY0dkZ0NIMGRrcktZUlE?oc=5,RSS_google_sia,NA,NA,NA,2025-11-05,2025-11-05T11:42:29Z
