headline,description,link,source,author,query_used,pub_datetime,pub_date,scraped_at
Japan Airlines Completes First Overseas Heavy Maintenance on Airbus A350-1000 - TRAICY Global,Japan Airlines Completes First Overseas Heavy Maintenance on Airbus A350-1000&nbsp;&nbsp;TRAICY Global,https://news.google.com/rss/articles/CBMiVEFVX3lxTE5FMTBPZUdkZlFxNXlOMEwyR1MyZ2Y4RkNKTE8wcTVBajgyZ0tKeVV1dVc0eTJKd0R3S0pNMW54X2MzclM4RGRUd1lfVkJnZUkycVJYdQ?oc=5,RSS_google_boeing,NA,NA,NA,2025-11-04,2025-11-04T08:15:20Z
Meet the Airbus A400M: Key Facts on Indonesia's New Military Transport - Tempo.co English,Meet the Airbus A400M: Key Facts on Indonesia's New Military Transport&nbsp;&nbsp;Tempo.co English,https://news.google.com/rss/articles/CBMiowFBVV95cUxOWUs1UXVIVGJZZ2xvTC1NVGE1Rm4tcnhzc2lkUFFfSHZ4R3VRLWtaZDlSWGdEbDJCOTZrOGVVcWgyOGg4MVNZeG00ZDhEYkM4ODl1NmtfX2liQ3NmTURjVG1xYU9MMUo3b1Z4YS1INVlWanhac3hSdkRtQTVEaHphR3FoN2xqbmxTVmxuWV80bWVZeElYbVYzLXhqUkhXRGhjZVJR?oc=5,RSS_google_boeing,NA,NA,NA,2025-11-04,2025-11-04T08:15:20Z
Here’s What Inspired American Airlines To Introduce Its Special Boeing 777-300ER Retro Livery - Simple Flying,Here’s What Inspired American Airlines To Introduce Its Special Boeing 777-300ER Retro Livery&nbsp;&nbsp;Simple Flying,https://news.google.com/rss/articles/CBMiigFBVV95cUxORzdBRDYtdE16VVdndXM5YmNJSTdGZ2ZrT1ZudzRiZTZETkdKUm1GVzBoUVZ6MnZTeWloMy1Ua2JoSENKMzRhZXZnRnpyc0UwQUJyUHBQaVhHMEJmUU5zLXVuZnlKdEEwWE1OR3podlZTUWJsc2hGVVdGMlFTNHVzc0ZZWDh2S0UyZnc?oc=5,RSS_google_boeing,NA,NA,NA,2025-11-04,2025-11-04T08:15:20Z
Baker McKenzie Advises Thoma Bravo on USD 10.55 Billion Acquisition of Boeing’s Digital Aviation Solutions Business - Legal Desire Media and Insights,Baker McKenzie Advises Thoma Bravo on USD 10.55 Billion Acquisition of Boeing’s Digital Aviation Solutions Business&nbsp;&nbsp;Legal Desire Media and Insights,https://news.google.com/rss/articles/CBMi1gFBVV95cUxPS0pZOG9oTmU3V3NsSy13ZllUZkpSUkh5N19fYXZlcFFEZ212OTBqZXAzdjNBOUI1SkhkUFpTRk9HdzdiQkZHN3RnUjhoNE5CQzF4RnNOYTZuYXRRNHhyR1lUTG9pN3NoOW1KODNFbThtc2NEbndDTEhDMC1Za2dUQmNGcmFIcG1kUmtOcGEzM215Wkh5Mko1UlRSOUhHQUtKRF9BYm9DOXFwU29OMGk4LVBXSGhuTXF1U1d0Mlh3bFdPT0NMZE1LS3NteU41YTdpUGUxb1ZB?oc=5,RSS_google_boeing,NA,NA,NA,2025-11-04,2025-11-04T08:15:20Z
FDH Aero Signs Long-Term Agreement with Harbin Hafei Airbus Composite Manufacturing Centre to Supply Critical Fasteners for Airbus A350 - The Manila Times,FDH Aero Signs Long-Term Agreement with Harbin Hafei Airbus Composite Manufacturing Centre to Supply Critical Fasteners for Airbus A350&nbsp;&nbsp;The Manila Times,https://news.google.com/rss/articles/CBMiswJBVV95cUxPTVlWNFlNU0QwNzBibHRlLVZ3dDlLbmZDWHpiaW14YlNMUTRTdFBtbklTdGNlNGI3SVlucVdYdEo2TTNCZTZDUldNdC1CN2twY01DVzQxMTNLZGNKTEJwbGhPcEhQNTduYmo1OEU5RUZtRmNrTjVUYUlzSXBDQWU4eW1UWGtqeVM0MFZrMS1JYk9nZ3RtaFR0eXlBRFRSbzBoWUZEYXdqQ1otdFJpbVkybzBTUnJHUEFoRzJDYjMzMGJpTnlfeld2NWpIYXYtRzZCYmpqRUl0bUR3eVA3Y1J0R3FjN0lHOFJaNmdpLXFfUzgyRDFLWkZJb3hSczhLRGJaX1pwMlp5a3BqdS03UDdoV0ZDV2x0OV9OS1JqUHB2VS1iMDZ5dnE1X0tTWW9laXp1R1NF0gG4AkFVX3lxTE5FWTZPQVJsZWtxeVloOEI0RmktbTMxZ1dEYjFIMXUxTW84S3BJWlNha2NBYTNrdXAwV0lxd3VvY0s4aHVkZXE1SWpqX1ExY3REUHY5cnp3cFM4a0FXblJiOE9ERHdNV1MxdUNKY1VGcG5OYWtaMWRqaDJWNXRMRWR4LU9DMVVqRkRnV1BpMXI4OTBLbm5WS2tMNjZubnVHSUFLRlFyTXdmRzFxdGpIVFBHaEdnOVpOcGtsS2RaVGlFVTZuWjc2X2p5V1FlMEhiWnJnNHYycDRUWHd5RnV6bnJ1bE04ckEzVmdGOWFVVnN1em9pV3l6M3dVX2F2ejd3alNDd0Z0UWFoNjBXV2ZTN0RrVnpHaTV5SGlLRHllUnFNVThqelZlYi0yWDlIUUw3Wjdld0dyRXlTMQ?oc=5,RSS_google_boeing,NA,NA,NA,2025-11-04,2025-11-04T08:15:20Z
"The Boeing Company (NYSE:BA) Receives Average Rating of ""Moderate Buy"" from Analysts - MarketBeat","The Boeing Company (NYSE:BA) Receives Average Rating of ""Moderate Buy"" from Analysts&nbsp;&nbsp;MarketBeat",https://news.google.com/rss/articles/CBMizgFBVV95cUxQaGxVenh5UzlWd1N2MHJkbjNRZWxiUWQxblg0Z3BqOFRsUl9yR0RoU1dqbW1PbVYtVVFvZHpsUGI5Z2hNSGJnUGU5eTdXY0UxTVRyVTc5am40VU1acEdILUE1VUVURnYycURBSUp4dmNnd2pvVzJOY0RtcEsyNUM4Z25rNkdxRDNQdHpfNWRsLXZBWkFvbzNrWnpIY3lvZGgxakNYcWVtTGpWZ0RXUVNCRDZHdnlXclRXX2p2c0ZaM0xOZUk2WUwzcG43ZHZPUQ?oc=5,RSS_google_boeing,NA,NA,NA,2025-11-04,2025-11-04T08:15:20Z
Royal Thai Air Force orders next generation Airbus A330 MRTT+ - Airbus,Royal Thai Air Force orders next generation Airbus A330 MRTT+&nbsp;&nbsp;Airbus,https://news.google.com/rss/articles/CBMiugFBVV95cUxNckFGU1h4N3R4VnczNjc3aE41UEd5T20zMXNBMFN1SWVQUVNyX21uWDhyalZhWU5QeFdKbXpOZ1JxUTFWeklwYkZmZk1XOUpXV0ZaUEo2aFZWN1FPVVlFbTBvNWk5NzBKb2lvTHpFUHd6b1ZORTNUQ0hsajdhMzJUY1dtd0Q2N1h5dkFPaGNaQktuYUFUZHhodUdybFlXUVVsVC02UUdJY0dwLUppQlh6ZWdubGlQclJBQlE?oc=5,RSS_google_boeing,NA,NA,NA,2025-11-04,2025-11-04T08:15:20Z
Ryanair raises prospect of more than recovering FY fare decline - Reuters,Ryanair raises prospect of more than recovering FY fare decline&nbsp;&nbsp;Reuters,https://news.google.com/rss/articles/CBMisAFBVV95cUxQRVI4UEZiVkNxMUJUQW1WdmQ4cDZZRi1vQ1Z6b2xYMWJpMTFVZlpuaUYyVEJzQ2xuM2c3eVhYa3hhNFRqYmY1RXp3MU03dVpoc1NSZTB3Tkk4REhPbk9aTkxCckl4cDFqSXRtZ2Q3N09wQXpLOWpLNmJ6RDhwcld0R0p0bzlzUHRScEJ0NkgtTUtaZ3EwYXAwREd0dkR2VURVTXNEQWUzSFh0cmktMkx3RA?oc=5,RSS_google_boeing,NA,NA,NA,2025-11-04,2025-11-04T08:15:20Z
Tourism Boost for Vietnam and China: Air China Launches Direct Flight Between Hangzhou and Hanoi - Travel And Tour World,Tourism Boost for Vietnam and China: Air China Launches Direct Flight Between Hangzhou and Hanoi&nbsp;&nbsp;Travel And Tour World,https://news.google.com/rss/articles/CBMi3AFBVV95cUxOX0hESEVudURublJhbjVpSXNvVEVKSFd6S1pqNlBVY3Y4d21nUXU3Nl95QlNsU0xHemQyLXMtMndlTmJjVEl3OEljZnRwQzFTRm10b2FfZXlLYTlRYmFXOWFTZkw3UkNTNlRqU2VCcHJMSFFURWVBTHEzQlVXMWc1d1g2SWY0cjk4NlpmZmlUQ3JxS3N3ZVVEU043M1NGZV9oeTI2c0dhZ09wUUZCU1JLZjRLbWJoM2NnU2lrQ0NnSGhEb2psbmhkdkFuUGRDYWlmSG1oQUROVXJ2TGlE?oc=5,RSS_google_travel,NA,NA,NA,2025-11-04,2025-11-04T08:15:17Z
"Air India Quickly Responds To Critical Technical Glitch By Diverting Delhi–Bengaluru Flight To Bhopal, Delivering Spectacular Safety And Care To Passengers - Travel And Tour World","Air India Quickly Responds To Critical Technical Glitch By Diverting Delhi–Bengaluru Flight To Bhopal, Delivering Spectacular Safety And Care To Passengers&nbsp;&nbsp;Travel And Tour World",https://news.google.com/rss/articles/CBMiqwJBVV95cUxQLTE2end3cXU5WnoteUZXYmxEaEYtVGRvLWJQRkdvOUJQZVJudE9VOVRPTEkzam1TbXVYcDRnOWlwdGhWVm1nd09NWFhFN0NGRzNGa0o5OFdWb291bW9reFZoc0NRVTJBSEhOek5lMzBZRjFidXdBNDBNSXdSeTBDOFlPN0pFUGd1amxaanhwU3ktQ3F0NU1HVTVlQjhzYllyUnA1TkMydzlhOHhmbGhzcnNHUjdRWmR0T2dhaG1YR3VETE1GV1NCVVFqNEJCNXRMTlZpcjNYYldVcUpYTUZXYTNmTXZLUThzbm5wckRsRjg5aUFmd0xhbnJ5aU9lWS1QR2JDeEM0QTdYc2JGVW9tZTJHb29ObGFVWU1lNGNMUHlYMDFnR3lLaC1YRQ?oc=5,RSS_google_travel,NA,NA,NA,2025-11-04,2025-11-04T08:15:17Z
"Travel Disruption in China as Over Seventy Flights Are Cancelled Including Air China, China Eastern, and China Southern Affecting Key Routes to Beijing, Shanghai, Guangzhou, Chengdu, and More – New Update You Need to Know - Travel And Tour World","Travel Disruption in China as Over Seventy Flights Are Cancelled Including Air China, China Eastern, and China Southern Affecting Key Routes to Beijing, Shanghai, Guangzhou, Chengdu, and More – New Update You Need to Know&nbsp;&nbsp;Travel And Tour World",https://news.google.com/rss/articles/CBMi3gJBVV95cUxPQTdVX2sxbVdiY3QtWUNEQkM4X0dYekJGWDlwUUFaMlZnRWVFUEZLdWJHTVlRUFlvU05SeTN0RjFSWkxqOGJlNFcwbzBYVXhDbE5SMzZ4Z3lmZkJ4REk1and1TDFYaFVVWjJjU3hIQWdLZlNCLWZTMXo5MlJGS1cwdDFuWGUtTUZKOEZHZUhtYWZtWVAyVXZiNWFuMmQtTHozUDZraWVuRHNWSVhGc1gxcjUyTjNPLXk5UzZUZklWYzZrMnBBWEtEMHdyOTJadFRHWGZLUzBHcC1jbkwzVzd4T2EySmNJYUZTZWJhQlV0VWlkRHUzV1dJSDlqa2ZOa01LdXhtbFlycl9naGRINEU3SFlLaDJfRnY1LXNNWTE0Z0hleFVLV25iZzd5am95MVdSZ1ZBZERZMXZjem0wU2JZZ3hnekR3Vno4N0c0cjNHeGtfVnZlT05CckFwZVludw?oc=5,RSS_google_travel,NA,NA,NA,2025-11-04,2025-11-04T08:15:17Z
"Air Do and ANA Wings Spark Travel Turmoil in Japan as Thirteen Key Flights Are Cancelled Affecting Major Routes Between Tokyo, Osaka, Hokkaido, Kumamoto, Matsuyama, and More – New Update - Travel And Tour World","Air Do and ANA Wings Spark Travel Turmoil in Japan as Thirteen Key Flights Are Cancelled Affecting Major Routes Between Tokyo, Osaka, Hokkaido, Kumamoto, Matsuyama, and More – New Update&nbsp;&nbsp;Travel And Tour World",https://news.google.com/rss/articles/CBMizAJBVV95cUxPY3lYWF9SUXIwWldxUlh4dWdELUNpVGFxWTVBQWdESEZud3hWWDFIMEtuTUhndURsREpYTFY2NGVrVDRBZVpUM2Fsbkh1blYxV2ZpYzhIeHJvN1ROcDdpOUprOVdWWVNjQnE4eEZrWTVfVUJRUXRQRkpCelBtdWVlLU5TZnFZMlQzNnJlZHRsQ1VzaDhQMHAxbG96d016U0J5NEMzMEZHUmdkQmlUUkIyR0VtZVAxWU44OE9tb3IxZkx6NXg4cDdfZ3J3ekY1UzFnOFV0XzVVUmhIMF9TMDFZQ2xLeE1MV3l1cnZRdWtEdDFwTHl3ODFfdkRZUWlBSUJ0R19TRExwOF9lVnZqbkJ0MElWczI1MGxicnVIdGZtaGhBT3UzbDFFMmdKSEZSOS1HbWFRb3JKdGwyaHZnVjVFeFVWR0liMFFDeGRuRg?oc=5,RSS_google_travel,NA,NA,NA,2025-11-04,2025-11-04T08:15:17Z
Air India San Francisco to Delhi Flight with 777 Diverted to This Sparsely Populated Region - Aviation A2Z,Air India San Francisco to Delhi Flight with 777 Diverted to This Sparsely Populated Region&nbsp;&nbsp;Aviation A2Z,https://news.google.com/rss/articles/CBMingFBVV95cUxOV2U4YnJqTjRCVjdwMW9SNXpoUXE0NUVuMzRQVldpeExFWW5jT3o0dzQxY3RUUzZQMUkyWHlOVE5obkIxNThWYm5pZmM4RWxRNkdtNlR5THBwZUk5a29zeVE3YVBNc3dCMmJxVU1tWEdpMHhZNzI4QUtGcE5VUWROb0hDLXNSQ1JOSDZSTGJLSGZRR3VSdnlhb2JGa0lhZw?oc=5,RSS_google_travel,NA,NA,NA,2025-11-04,2025-11-04T08:15:17Z
"Lufthansa Joins Forces with Turkish Airlines, British Airways, Air France, and KLM Royal Dutch to Create the Ultimate Airline Dream Team in Europe! - Travel And Tour World","Lufthansa Joins Forces with Turkish Airlines, British Airways, Air France, and KLM Royal Dutch to Create the Ultimate Airline Dream Team in Europe!&nbsp;&nbsp;Travel And Tour World",https://news.google.com/rss/articles/CBMinAJBVV95cUxQbW95UWJ5dXktWTdoR2VYenhCT3NXN2tNdktya25xdUJIOW50LVNBVmk5ZzNJb1NfYWRQQXoyN2hOVEo4azJ4V0kzZE52Tk02Uko3b0cwWUVfbWMxcEN4ZFFWWE45ODFVeGZvTG5rSHIxTkZQWGhMTkM0Qy1LbUloUEtoMkhER2dYcFhabFAyQkNXX1U4WWcwenEyLWczaU1XbUVxTk9sQnNSQ3dwMU1BeU5NNnpLeWRGS3JWRjhWRVh5WklkS29RQ1FTSTBQcUUwbkdFUEkxVzRSVlVYVGo2X3ZIbVhQNEZCSDlLNW5WZmJteUlzbGU0c20wUE9rUENVMWlpdnJQb3lDQ1ByN254dHR0cWFITWx3Z0RnbA?oc=5,RSS_google_travel,NA,NA,NA,2025-11-04,2025-11-04T08:15:17Z
Passenger detained for trying to open emergency exit on flight at Varanasi airport - Deccan Herald,Passenger detained for trying to open emergency exit on flight at Varanasi airport&nbsp;&nbsp;Deccan Herald,https://news.google.com/rss/articles/CBMi1gFBVV95cUxPanhmRTJNd05rVWdxZV8xWmZBd190RHotSDlHTE1HazB6WVl3YjhXZnA5enpOSHdUZWpuaTI1akVsSE9EZURRWFBFb3hpY3dfcmJUQkF2SV9kTHZRQ25ra2w5ZkdVVmUwaWVWeHFNZWFHN2pWajluTllfeGZEdnlIMDVldjVITmZoWUZJb3RhR1FISEhmN19xMmRlNWRuZnd3T2hVaUZIV192MTJ6cmgzQ2d6RDA0QXZjYkNXOHlyVTU4WTRhN2lqN1RLOE1oMGZvc0dTLUd3?oc=5,RSS_google_travel,NA,NA,NA,2025-11-04,2025-11-04T08:15:17Z
"Air India Express Flight from Dubai to Mangaluru Faces Unexpected Cancellation and Delay, Impacting Travelers to Karnataka and Kerala – Details You Can’t Do Without - Travel And Tour World","Air India Express Flight from Dubai to Mangaluru Faces Unexpected Cancellation and Delay, Impacting Travelers to Karnataka and Kerala – Details You Can’t Do Without&nbsp;&nbsp;Travel And Tour World",https://news.google.com/rss/articles/CBMiswJBVV95cUxNeHpmeVVOQ2xXSG1RcGFZRlFXSDU5b2I0cnd5ZGhxbHp4UDdFMEJpX2xYZVgyMWdiYXhDYlV3dDFxbXhhaVdCdW53OXo3QURkakhYRWtoaFcydlZVeHhHRHRzRDNMdy1CX1ZyRy1FcXJjQmNDYUExMlVta3VQeVRudWdNbkdtazVNemdaRlpSdlRocFIyMURKZjQwQndSVk96V1l1dEgzR0JabkJRWkZsRzF4ZV92d1JsLXR5UG1qZHEyeGoyY1dDSUp1SlBINFdTV3YxcGI2M2pzWmJfdG5KMlpoN0ZydzM5dUxZaE9oZm1ZVUJSYjd3bS05bzM0OGhQY0djSGpuUXA0Zk0ycjVNOVZnU1FQOHEyQzZnbVZSS2k2TV9YMVJNNXNuXzhWdTdXTVJr?oc=5,RSS_google_travel,NA,NA,NA,2025-11-04,2025-11-04T08:15:17Z
"New Air Bridge Between Turkiye and Iraqi Kurdistan: Turkish Airlines Reopens Istanbul–Sulaymaniyah Route Boosting Travel to Northern Iraq, Details for Flyers - Travel And Tour World","New Air Bridge Between Turkiye and Iraqi Kurdistan: Turkish Airlines Reopens Istanbul–Sulaymaniyah Route Boosting Travel to Northern Iraq, Details for Flyers&nbsp;&nbsp;Travel And Tour World",https://news.google.com/rss/articles/CBMirAJBVV95cUxPcmhGejhTb1JMbER1a2pJX3FyVklwaE5GY2FpcWxsX1JjRzFSSFZYWGxteWF2eEVVTVdvekRkcnpSZmZiZG55YWxtLVRPbTVpU0ZHNGVvOEtXOVlIdF9XZngzbjZBeE9XeDRtb3NWRFlQdUVwLXI2WGNZQUZ1cklGdERPT3ZwR01BTVBDWWV0WWFkNzZkRWZUWnh1NnhlRXhDT1pTUGZKNlFteWczelVwTFZWQzFib0lMcEs0NERZNTVjYmt2UHhhRjFuM0ZiTktTVHpmYWcxdWJhYmZDVlRFOFctOHpyRlF5RDJYdXdCQm1ZVWpyWV9VX3pPaWxHbFFzWkg5V05YRzA4QU1OWGFPZDFTcHh2RDlPeXRlWm41SlByOWQwMlpjc1ZzRHQ?oc=5,RSS_google_travel,NA,NA,NA,2025-11-04,2025-11-04T08:15:17Z
US Shutdown Haults Air Travel: Record-Breaking Crisis Disrupts Millions of Passengers - India Today - India Today,US Shutdown Haults Air Travel: Record-Breaking Crisis Disrupts Millions of Passengers - India Today&nbsp;&nbsp;India Today,https://news.google.com/rss/articles/CBMi1wFBVV95cUxPT1lrVERELV9vZW5BRlZaNXZRUkpuTlRRMkY4dnpMWTV1YUVVbzRlV19vczY1YUhmWHFHbWFxczhaVktzTzlUdkRrZWprR0ZtTmNyWF9kUEN5b1FseFAxMzNxWklfUXYyVFc2N0xucDZrZEllVVF0STRHZWlMenVlc3RNUUwtMGpVUDNUeldnYXRXWjBDM2VtLXVick9vU2pUd011ZFJXblhMY2d2R1JrblVybUtpc1htLWtmdUplYy1tZHdhdFFZV3JwbHZub25GdjB4LXVJWdIB3AFBVV95cUxNRkRsTG5aNmpwemRyelU4b3h1Mlp6WEs3eXpxQnl2OVBRelVsM0pKdjR5dEhqVDRnMjNZdDYwMzk3LXU0WGRrMV95V09kN2Itbm5GVlBLOWNJVFZCX0pKaThfcTZCMXNURm1vMlhMMWJsWnFnVGZuMWlpS3VNbFV1TV82UG1mcHRBcEZTSk5LcDFkTHlqcFFDNWc2dzU1RlFrNDR0cG5Ua1hMMFFLVjFKUzhSck1kNXlrbU9QcHhhSG1ua2ZIbzUxblZKSnRSWUpqS1hnR0dlQkQzTnVq?oc=5,RSS_google_travel,NA,NA,NA,2025-11-04,2025-11-04T08:15:17Z
Air India Express Cancels Dubai to Mangaluru Flight with 110 Passengers - Aviation A2Z,Air India Express Cancels Dubai to Mangaluru Flight with 110 Passengers&nbsp;&nbsp;Aviation A2Z,https://news.google.com/rss/articles/CBMiuAFBVV95cUxNakd3TVNkNEJkSlJGZUlQdzVvUEE4VzBFV2FKaHpNYjBCa3FuUFFiSV9pcklIRzNzRmNIUWRBcUQtc0VmRmoxckltbk1QdmtVaDM0WExGUURiQmVfUGZaZWowd1lDXzhKT2thOTdGVGM3Z3QtQkdrSlhOTGR4bTAxUDExM3dDOWkwWUZjdTVwa2hsRWxFc0s3ZXk4UnhZSnlHRzZ1dVVqaGVLdWhfTGI3akxwNDIxcm45?oc=5,RSS_google_travel,NA,NA,NA,2025-11-04,2025-11-04T08:15:17Z
What to do if your flight is delayed or canceled during the US government shutdown - Oregon Public Broadcasting - OPB,What to do if your flight is delayed or canceled during the US government shutdown&nbsp;&nbsp;Oregon Public Broadcasting - OPB,https://news.google.com/rss/articles/CBMivwFBVV95cUxOTGgwS0JfU1Z0cEZUektTUHFTZU9keDRUbFZOY2YtSkN6ZndJQW1hUGlmcVRQa04xdnBCRnNfa1NteTVRcFowRUNJMmp3Uy1xOFJBU0l3ekg1UnZuWnA4dWhOVTJFZldPMkJsYmVhLXNtZHhXWUI4UkdDWUx6cFpqNHlpd3RabWI4QnFuUkdILXlfNHZLUE03NUdxYlhMSHRjQ0VESUtlZXZWVVhSM1JxTjlzQlhmaVpVYWRwbFlpbw?oc=5,RSS_google_travel,NA,NA,NA,2025-11-04,2025-11-04T08:15:17Z
Panic on Akasa Air flight: Passenger tries to open emergency exit at Varanasi airport; says he did it 'ou - Times of India,Panic on Akasa Air flight: Passenger tries to open emergency exit at Varanasi airport; says he did it 'ou&nbsp;&nbsp;Times of India,https://news.google.com/rss/articles/CBMinAJBVV95cUxPaFhUTjBYM1NlQzJuQWJTcWJPVlB1dEIwQk4wMlJqNlFMSldDaUs3blJJLTVjc1FRMnNpSW1QOUU5X0YzemU3VWVsUTZsalk1c2REZExpUjBkU2tCeXhrZGJLRjZGb2doMTB1eENpaGN0d3RYaDFaWlNRX3diUjE4cllJT09UNnMwMGpqaEhqZ1EzN2wyWGdxVzZ4Z0JnRmVQazVKdVNCZmZWT2I3R3NPZGVDc1VLbXZxS2Z1cEVUZjZhb2lYdDNZcHE5MkVoSENtaGVReW96R1l0c083bHNSUk1ON2tvV0xvX0F3Nm03eldEZUtDNU56c1NWcTJEcGFGUkxMVi1zRFhGdlNTa2JGbExHLTNfQV9ldjdjLdIBogJBVV95cUxQUm5EV05uVU1tNFJIWHA0b2xaWkNLY0Z5b0d0RDJJRWtOTkpteUxyMjVBdWR0TVFGaEhLOFJHZV96SFdwZkJBSUJlRUNfc3lMS1V5Z2NUS0F1ZjJxbW9mN0NIbUJWaUNpNTQ4YndqWGh2eWViRlh3b0ZQXzd5RHdRNWN3OFBRak5YRVNmVGZIa09SbWlNNEdGUlg1a2RvNWthOXJhbGptOTlDQW9CNlhvUEFDTkg1bDhKLXJoSUE4Q25ham8wUXlhd3JzRHVIdHNvVmduVTlUYnFOOHE5STFQVW84VmNWSWtKYk5fLVZIOFk5cGVZWUdnTG1CNDhCMml2eGlBa0ttdlg4X1MydTB0NTFUWmlPSEtaTXJOSUx2R09jQQ?oc=5,RSS_google_travel,NA,NA,NA,2025-11-04,2025-11-04T08:15:17Z
Passengers of Air India flight diverted to Mongolia given hotel arrangements - The Economic Times,Passengers of Air India flight diverted to Mongolia given hotel arrangements&nbsp;&nbsp;The Economic Times,https://news.google.com/rss/articles/CBMihAJBVV95cUxOWGxMN0NfOEIwTXpVX3M1WFNuT2FxQ3BhSTlnZ2h0WkkzUnVIRlF6LWpMYzdvV3Vzc0Q4TWxxRDR6VzFUUzU0SzhpR2pFUTJreGFaVVJXSUEzMGRKbl9CWW93bXpDVllCbzhxaGllWGJGdFRuRE1BWWFpWFR0NkItUWVsUGNoSVlZM3R4QjIxRHEyR212aVpHeWdXanMtbDQ0WEwySHBYRTUzb05HUzNqMDdaczhUVW9Va2k0aXdQNEF5QnZBSFRiaWNydVAwaGo3eFBmUlFJS2x2Ni1oOEdnRDNOSTJIZjhrSFYxUE1KcmdGVWVjMk5pMkROLTk2Wm44S09NUNIBigJBVV95cUxPLVIzRHQ4dmtzMU5rZWJIUzE0TWZUbHhySDBURWQ4YnY1ekpEVElZa0dJMktQVXotdVFKUmRGZ0FacnpySjNqOW9JS2RVeUVSRXhpYTFpWUZ4eWRRamFpdllLUXh0QnYyNF9qTjE5SDdrVkVySkJSclpsRkdCcEVKX0RFaTc2TVlTelNzQjVlaXlXOWFIT2hCTHY0WWZ1RDNRMGYwdmVwSzZvQmpKc3lfVkhmeVJEWEVkS3puazJBSUtXcUlHUW94eHZ4T2k1NmFyQXRsTjBXYTJsSFB0UDBFY1ZTYk1NVzBtOVJ6S21faWlDZE1raHktY1M1VzVaMWVPRFYwZW1TX2d2Zw?oc=5,RSS_google_travel,NA,NA,NA,2025-11-04,2025-11-04T08:15:17Z
"US Government Shutdown Day Thirty-Four Unleashes Air Travel Havoc As Unpaid Air Traffic Controllers And TSA Workers Push Airports To The Edge, Triggering Unprecedented Delays And Risking Passenger Safety - Travel And Tour World","US Government Shutdown Day Thirty-Four Unleashes Air Travel Havoc As Unpaid Air Traffic Controllers And TSA Workers Push Airports To The Edge, Triggering Unprecedented Delays And Risking Passenger Safety&nbsp;&nbsp;Travel And Tour World",https://news.google.com/rss/articles/CBMi5wJBVV95cUxNSVpQd2pkLUdCUkZhVlRINU9OLU9DYV9ZRW14dlFKTkk4XzMyRlNmTXprRW00OXA1SFJyZWlYb051WGxycWExcUsyNC15V0xfNHNseE1CR0V1cEJIUkZsdV9tNy02cXJJR0JQOVVtNDliUXZmNWFYcjVZSFkweFFqYmxkdEdSN2pLVW9DX0xpY1hQX08xM3VHX2psM2tvUmcwS2Izbi1YRjBud1ZIV2NCTUFvR1A0Q2hKS1VmQUx1OHVicHowV2kzRnIzVFAxZHFfTmFLMGZ3cVNWZHZjUFdDUURSYk5CYWlJSzhJNGl2eUhYb0duTTh5dzBuLUVfNDlNTWUtWF9TaGF4czhCZDg4anpVd0tncE1SYi1zM1ZZSTZLRUdKNHRpYnN4RHNienltV0sxQkF3WVV6OWktRGdRYTN0T1NIZUFlWW45cDlfNXRIN2Rjc21fdHdPTGVHZDhUZGhOUG9rWQ?oc=5,RSS_google_travel,NA,NA,NA,2025-11-04,2025-11-04T08:15:17Z
Man tries to open emergency exit on flight at Varanasi airport; arrested - Business Standard,Man tries to open emergency exit on flight at Varanasi airport; arrested&nbsp;&nbsp;Business Standard,https://news.google.com/rss/articles/CBMiywFBVV95cUxOU2xZVUtoU01hNVFQeDE4S1otMmFheENUMUlLMnVlMVZSR3JxVHRnSncxSjExcTQwbFV2cG9XT09pLWdaWU9UanRVZm5LcU5IZHU0d0g2eDJXbFlwUlBORHN2aUI5LVJrZ205TlVYaGpReUVCd2tVd2dwaVdHOEF5eFpQbXdpMENfLUdRQ2g4VGJQbmNpY2VPQlNVT2czRmFkaEpkRm1Qdy1TbFJ4Ym1ENVFBTmVkTF9FNnpVSDNUOFhRczV5ak1NLVA2MNIB0AFBVV95cUxQRHRhVEtvU1pHN21zWUhhUm5VQWt4Z1NXQWd5LVZOVHl1T0hlcW1fWFRjcjVwdHIzVW1SZkhBM283TXJfU0pVQlpIVURUSTM2VWRGWWpXMjZqLVJyOGdtYlpDeUxqNVRzOUhfX1ViRGFiZEp0eGpNUUdXeDFjejBCX05mR3ZXRXlSdlhnSEU3M1hOSDFsakRJUlo5Nmx0b2NmODBNdEV5ZEJtZ2pnX2txVHk0bzdURjU3WEZEeHNvZEVNd25JRl84VW9JTFVrbTRj?oc=5,RSS_google_travel,NA,NA,NA,2025-11-04,2025-11-04T08:15:17Z
Scare on Varanasi-Mumbai Akasa Air flight as passenger tries to open emergency exit doors; arrested - livemint.com,Scare on Varanasi-Mumbai Akasa Air flight as passenger tries to open emergency exit doors; arrested&nbsp;&nbsp;livemint.com,https://news.google.com/rss/articles/CBMi6gFBVV95cUxORFNNZ3h5dW9vNjlWRXVkVmVzZFgtOVA1cTFuelhvME9EWDBWYWIxWHlFZ3FSNEFwdGFSRjUxVUR1SDdxMjJuVlhIUXY1bEVTWUp6MDVTMEcxbVdsYllmLTRlRkRGZVZLQ1BRWjZvYXBXMEJNMy1hd3B2Z0RTcE1NZVVQSktFYk52TlhIV1JjYVMzUDg1dFlRUFk1ZUtvU0Z6MWNfNldfT1lHbXRSYTlkUnFKSmlCRW50eDRQdEFhdjFrem9CckVRbGdEeHc5MTlxUUhrbjdMRVJsZzNJbXZfay11a09KNjM3OEHSAe8BQVVfeXFMTXRpSkNNNzJXQkRSME1idDVBeTl3QlVyb0R4WlUwTFlYdTFyNTdweGpReERLLVJ1eTNpWlRjRU9oenJfcGZFRUJWdlZ4WXpEQUJVek5oYUNxeWJSdVVRSzRrTld3Ym9peURzXzBESGY4bGZvdjRvOVJXTkxhaXFNN3psbmVWYW94c1ZjTE9pV2dTN2NqZmNVc051ZmFLQmMwVEhyYjduMlhhMXNFYjRzZ0xka3Z0T3dBTmJIOC1ORkJtZDgtdThOeGE5bkl6TmJ2TTVFZURmZUJ5UmFDRVEyZ1dKSkJldkROeE9ybmdwX2c?oc=5,RSS_google_travel,NA,NA,NA,2025-11-04,2025-11-04T08:15:17Z
"New DGCA flight tickets cancellation, modification proposal, rules soon? Why it will be a big win for air passengers - EXPLAINED - ET Now","New DGCA flight tickets cancellation, modification proposal, rules soon? Why it will be a big win for air passengers - EXPLAINED&nbsp;&nbsp;ET Now",https://news.google.com/rss/articles/CBMiggJBVV95cUxOUXEtQU5ESk5BT3ZMeE5wMHREdHVXWVByN2RpRGpKYmYzUjIwUWNYVHNGQ1Z3QXpNZk1IQ0lRNklBQVBEWTV0a1FhTWdVcnBCSWl6eXJPSURMVDNiaDFpcEc5U0x2dy1lLTFnckkxTmdYblhMYVBaY3d4MjhHYWtoX1BjOGdidjQ5aHJ0WXlKSjJOTXRlM1NzNzhKYnVWVnNKV2s4ejRYY0NQdklyWVpPWmo0ZmVkVzRxMzhQSzJEaGlINHlsd1JRRGxnNGQyQ25SMENmeWVoUnJfTTZRWERiS3VRR2xVYWItcjNrWEJ1TXRGVVJWZ3FNSmIwZFo0ZEsyc2c?oc=5,RSS_google_travel,NA,NA,NA,2025-11-04,2025-11-04T08:15:17Z
"Delta Joins United, JetBlue, American Airlines, and Southwest to Face Shocking Emergency Landings in 2025, and is Air Travel in Jeopardy Leading to Travel Disruption: What You Need to Know - Travel And Tour World","Delta Joins United, JetBlue, American Airlines, and Southwest to Face Shocking Emergency Landings in 2025, and is Air Travel in Jeopardy Leading to Travel Disruption: What You Need to Know&nbsp;&nbsp;Travel And Tour World",https://news.google.com/rss/articles/CBMi0gJBVV95cUxOTFViaVZqRmw3aTEyUTBrTVpIZHJhMDByWlpTZUdhd3F4ZlkwYk9lUXp1QXNlZEl1NUUwbFQ2Z1JoWnQ1WTNlSGYwUXNndDVpTEw1Y0pMYXVhZFhfYWI4V0U1MGxjM0ljS2ZBTDRqei1SSm5EamlXcnFEWXNnd1Q5Nm1RV0JGSkFranRaLXlxV1p2NWZiZmU5eGN0bWtZQUszMEtZb2N4TUhBcXNWck1ld1dxY01DY09hblFwWUhlOU9KUkNRT1hpSjRaUXVVMkQ1LW0yYVpzYURXQTBFak5JMU13NjFjMENLUnUtMGJvLXRqS251d3BDWktndGFERFVaNnRVMG1EMGZ0UXRPSkFhUHl5N2tWN05zRWpOWFRObU13ck1oZmJVX1M4M042cjZ0Wm51dnRqUFpWSzdXRF9ycG5HSXYzb29OclpqNnk0b1JSZw?oc=5,RSS_google_travel,NA,NA,NA,2025-11-04,2025-11-04T08:15:17Z
Mid-air scare: Air India Delhi–Bengaluru flight diverted to Bhopal after technical snag; all passengers s - Times of India,Mid-air scare: Air India Delhi–Bengaluru flight diverted to Bhopal after technical snag; all passengers s&nbsp;&nbsp;Times of India,https://news.google.com/rss/articles/CBMiigJBVV95cUxOY2tKTjRjU2JJMnBuckx4bFMxMVktc0lQTGtIbURwUkhvNkgtdURTWC15YkxRd1FEbHdHNzJqejUyVkJlY0QtZW5KUVBFaE1CU2FOdWxzRmNaZ3EyOGJjVDctdnJZZWRET0FDS3dnc3N4b0tPZDVoTG1KdFpyUkJBaG1XdldGMUp3ZkZxb0xuRDBlMDAwWTJPOGhRQ2NEQ0ItXzJEZGFieUVmNFhPOFZDQ1E1eFljMzJUVlI1NEFEbGNnbDJKSHlQLXRubGlxcXlJTXhSN18yQUNCeDk0M1RlbEpoR1g4cHUxbnRiU2tlSUw4T3lVcG9hN3d2N25CeFhVU1JWRWNaTXp0Z9IBjwJBVV95cUxNVU1rZ1NYTTEwZ3o1VEd0Y1FwUnNZVEtqYjAtVUNTTzdnbFA0Y2JhSzhQTTlnQmIxeUJUZEFBZ005SnYzbGZhTjNtSnRpSHVFdTBpN3N2X1BXR3NNSFNYcV9mUkJwajZlS1Jwc3ZPdDdWeEJFcHR4U0FDWkkzRzhrMkdpOXJieVUyMU1ZbzllZXQyQzBwSFQ3LS1sa0FTOXBjMXRWR0lnREFHYW42MExqaTVyNG1BaXZVbDJxWHhzN1hiZEFFeFdlbEYyYThBa1RzSGl6cm5obTdLcXZHTEc0QWNNbTRvQ2U1OXBmaTFULUI2VG40bWhNeUlmcWNHbWpxejdvRmRGWU9ydW9Fbi1r?oc=5,RSS_google_travel,NA,NA,NA,2025-11-04,2025-11-04T08:15:17Z
An aviation hub that boasts a 10-story shopping mall and welcomes more than a million Australian travellers a year has been named the world's best airport in Forbes Travel Guide’s Verified Air Travel Awards. - facebook.com,An aviation hub that boasts a 10-story shopping mall and welcomes more than a million Australian travellers a year has been named the world's best airport in Forbes Travel Guide’s Verified Air Travel Awards.&nbsp;&nbsp;facebook.com,https://news.google.com/rss/articles/CBMi3wFBVV95cUxOQk5CdHVKMWdCNzR5aEE3SExnaXVHSmxjY1lHUnNBUXhSYlc2RF9iQm9CZWRINTk0MldWdGE4MUkxLUxZb3dxN2VCT3hlSklzVTc1R2Y4b3BmZXF4cXRMNmJsMWZyNXVfdERLNFcxY3ZLa2kwa0dnX09XdXJBYkhHUWJscHVpTGRZaTYzR3VTY1dGR1VqTkNfR0xJNkJzY2QtM2dvTVF2MkJVajk2YUhJTjZPSFRoaFROeDFGWUpHMzYtWGZKZGJlcFdxZ2s3bk5NZVd5TnRMdGFzVXY4RnM4?oc=5,RSS_google_travel,NA,NA,NA,2025-11-04,2025-11-04T08:15:17Z
Air India Express Expands Rajasthan’s Access With New Direct Flights From Jodhpur And Udaipur To Bengaluru And Delhi - Travel And Tour World,Air India Express Expands Rajasthan’s Access With New Direct Flights From Jodhpur And Udaipur To Bengaluru And Delhi&nbsp;&nbsp;Travel And Tour World,https://news.google.com/rss/articles/CBMi9wFBVV95cUxPRHV3QVFUN19BZ3Ixdms2Q1kyOVZIRXJ3ZUxOVExJdVdWVGc2TEhyYmtKOUxyTFktZzFFWlk0N0dYeVROVkN1eFZwOWhreTBnMWxsSjZyM3UycWMyaWhJNUlHNWMxM2VsYVpTVDNIUkVYMXJqZXhERkNGemp5ZmtTV1hlam1HTFhWWXZpWFY1aXBmYzcwaDV6R1M2aU5EODhIb2libHFpTFFMM1RSY2l6Q01GWGVhWDFnemxycVoyQklleFFvQzhNNk9lTUp1VUdaQzBhV1RIdklETGZHNy1XbXVXRTNZaDlLUmt6V3RoQzVmY3V2d0E0?oc=5,RSS_google_travel,NA,NA,NA,2025-11-04,2025-11-04T08:15:17Z
Air India Flight AI174 Makes Precautionary Landing in Mongolia Due to Suspected Technical Issue - Newsonair,Air India Flight AI174 Makes Precautionary Landing in Mongolia Due to Suspected Technical Issue&nbsp;&nbsp;Newsonair,https://news.google.com/rss/articles/CBMiwwFBVV95cUxPVG5xc2FrWHF5czZvSmo3cUtQU21zbGNfLTBvc1B4QzhaM0psRUlWNEFnaXN1VTdCclpxTGxIWjl3MkJ6XzZKMEVyWndyd1E1NGdPcHBOZHl2dEg2cC1KOF9sdHlnSnlVRTNrcTNTWFRmbU1qTkZTeVZudlowcGNsNXRrMnI3UG5wUnFpaE1XRVZwVXdqZ2N6Z2dTXzllNXRVTF9hWUlqM1h1YUxieE5VQlhzRmxtZmF2dkVZdGRpcWoxbVU?oc=5,RSS_google_travel,NA,NA,NA,2025-11-04,2025-11-04T08:15:17Z
"Air India Delhi–Bengaluru flight lands in Bhopal after technical snag, airline calls it ‘unforeseen situation’ - livemint.com","Air India Delhi–Bengaluru flight lands in Bhopal after technical snag, airline calls it ‘unforeseen situation’&nbsp;&nbsp;livemint.com",https://news.google.com/rss/articles/CBMi9gFBVV95cUxQekFwemhVX2QwRFA0N0JPTkF3SzRvZzVFd01tV2IxbnJFRkZrUGFlaXBkR2huVGpyT1gwLXhxeGthbDI5eFhMcDlrcFZGdFdOVF83VEpZVVZ2RjZ6S1BNcDRNSjBhSWdqUTlWUlNTZGN4SEpseXpYNFQ3eHdVanJyUzFBdGRJX241ZzliYzlyc181N2ZYMXpDOEdkVF9PR3hiWUM3V25LUF9mMzViemU5cVlsaG5xS2dmSUtZd2hrRkVtUmdMT2JDWG1RTjVmWWVaNGZWdHp6MUQxOGk4SGdqRjNNbTNlQ0lGSVVOZTdGRjFtQUZUR3fSAfsBQVVfeXFMUEw5WXBlUk5LMkVnLXNQOGFCdm0wR2lpUW5FMy1GTHFOV1FCN3VSZ1RLNUhpUjVuTk82VTB6U2YzVFQ4dUI5Tlh2Rm9GYlRXS2J1b052NG5UcmNVbGE1QlRPN09mU2dsdmJFRmkzY3JYY2xfUUZxWC1JVnNWTm9KQ0NzbDgwcGVBQ2FlQUNROVE2MzNBX0pTa2lDUnJXSGdUbHIxU0RFd3B0MmpoWmhDWkRQVy1ZWnpOSEl6cmhqdjZrQW9ub1lLTENDTklweEF5T2Y1NXU0cWg3SjRSVUFZVXlQX0FfLUJuYkFBSTZHbE1EOVcta1lTYXBLZUE?oc=5,RSS_google_travel,NA,NA,NA,2025-11-04,2025-11-04T08:15:17Z
