headline,description,link,source,author,query_used,pub_datetime,pub_date,scraped_at
How politicians and passengers gave up on greener air travel - Financial Times,How politicians and passengers gave up on greener air travel&nbsp;&nbsp;Financial Times,https://news.google.com/rss/articles/CBMicEFVX3lxTE04dVUwMUZHTS1XNGt1Nk81TGFJUDl4d21UZkdZbDhtdWJIVW5wZGdYX1lzdUN4a2Zjc253ZXQ1NlhEdjMwcEZlWFNDUk9tN2didkY2UlZfY1VEX2tvSGJaalRtdElFdnRtZjJkVWFhOEg?oc=5,RSS_google_travel,NA,NA,NA,2025-11-02,2025-11-02T09:02:00Z
Hopkins Flight School program launches to increase comfort with air travel - Spectrum News,Hopkins Flight School program launches to increase comfort with air travel&nbsp;&nbsp;Spectrum News,https://news.google.com/rss/articles/CBMijgFBVV95cUxPNnZnX1ZwSlp0UUFhZzdmMmZiUzdmbnF0Y3BOSjRNdXVmZjV2NmRmcGYtb1V3MGgzR0dMcC03djdDd3VDeFZDMG9LTFB2aVFMREQxLTRvTHNDOEJGcFlPb0x6NENiMFg3MDJIVVB1X0NjX3R5ZUNpRnRFU0pERUVUQXZyNWY4bmw0SGJWOE5n?oc=5,RSS_google_travel,NA,NA,NA,2025-11-02,2025-11-02T09:02:00Z
"Air Cambodia Introduces COMAC C909 Aircraft by the Next Year, Boosting Their Tourism and Business Travel with its New Sustainable Flights Across Southeast Asia - Travel And Tour World","Air Cambodia Introduces COMAC C909 Aircraft by the Next Year, Boosting Their Tourism and Business Travel with its New Sustainable Flights Across Southeast Asia&nbsp;&nbsp;Travel And Tour World",https://news.google.com/rss/articles/CBMisAJBVV95cUxOWGVyVms1QVhPM0VXTU5NaTM2dFo1S29OcVRISXVxR2g5SEpvd0RGNUdhbjlqa2pRTm1URnd3OXFLYXdoSW9vQkJwcXBXS0VFdUNUakh5R29tY0tLVXEzUXprQWs4YUVkd2dzM1VrSDJZbXNzOURUaWh3Vjc4VzMtdVNRTTJxUjdkbDlQTElBMmk5anB3NFdYbWpnV3JRSjVoYTdSQWprb1VRWkdlV1dFNDhLY2VEaHlLeGd4YUw3LVNBLU44UXBYQXFKU0pFREJYQkJmMTQ1YWJqVTN3cVR5WFFyVm5nOThfNU13ZVdqWFQzZG1ac0lpbmVtU0tQbklrd3lNbDJVbFNYRjkzbHhoZ1dacEtKUVR2Y1Nra3RIcGRTUnZJcGttQmVIT1VjQjFr?oc=5,RSS_google_travel,NA,NA,NA,2025-11-02,2025-11-02T09:02:00Z
A drone sighting temporarily suspends air travel at the Berlin airport - bastillepost.com,A drone sighting temporarily suspends air travel at the Berlin airport&nbsp;&nbsp;bastillepost.com,https://news.google.com/rss/articles/CBMivwFBVV95cUxON0l0OWRCYWdOTVZHUGl2MVMyN1JBUzJSU3JDNlNvdno4VUlSZnRfUkpYZkFhdkR5emdFd3BpcTRtQVlmUGowTFM3QlYtcG5VeGQ4Y2JHdjhUb0l5NFhqU0lfLW5tUkdzRFdOWVA2RmdwZURISVFlSGJaM2V3Q192LWVQZkctYWF1ZHpFaExuNS1yXzdkUVZtOENOdDdpbU83Ylctdmsyb2gxMkxhQkpCS09fUTczZkJpaHZZbmVYWQ?oc=5,RSS_google_travel,NA,NA,NA,2025-11-02,2025-11-02T09:02:00Z
Air-traffic controllers miss their first paycheck. The shutdown’s effects on airports are getting worse. - MarketWatch,Air-traffic controllers miss their first paycheck. The shutdown’s effects on airports are getting worse.&nbsp;&nbsp;MarketWatch,https://news.google.com/rss/articles/CBMi2gFBVV95cUxNVmhTSVpKeGNxeXRmckFpZWFudmxrZHo4MVZBV2JEZWt0ZWMzck8wSGcxQ01COGhuaXQzWlZvaXRZOHVjQUVXT1I5WFVCVVFFSEZDUUpZNVBJanJRWm1aVm1KM0Y0czh3anA1R3hmV2pwMUxmMDlwV2ViTFV3NU9yWnJzQWZ2OTY5NTZNMjRoenl4MV81WjJxOEJTRnFEdUZuNXZjMGEwQU1sUHFmQl8wQTlaNm93WGhJa2N3VEtjeG1qV1puanVyNkxmNUpvTHNkQ1NpbklIUTRkQQ?oc=5,RSS_google_travel,NA,NA,NA,2025-11-02,2025-11-02T09:02:00Z
"American Airlines Joins Air Canada, Wizz Air, Aegean, and Qantas in Launching the Airbus A321XLR: Redefining Global Air Travel in 2026 - Travel And Tour World","American Airlines Joins Air Canada, Wizz Air, Aegean, and Qantas in Launching the Airbus A321XLR: Redefining Global Air Travel in 2026&nbsp;&nbsp;Travel And Tour World",https://news.google.com/rss/articles/CBMiiwJBVV95cUxPZGN0V25LaXFybEZyUDlYVHBFNnNhZnoyU1R1cDRFMm5nVW5hNUxIbkt2WDdhSG0zODJWNjZRR3BJai1Ua19Rd0xtX093U3JCOGg2eVk1RmFUbVQ5T0JLZjBwTXJ1Rjk4QWZLeXUyNmd0S0hzVmVaM1BOVWxreC1nczlxTzFEUERKSHIyYVpNeEZGU2pYU3ZJY1lXaFgzRUtpZU1hM0ZwYXpIak1oVlI0OUFMYkRramwzYTRlSlBDM2NwVmVNR2ItX3BYM1JGVHdic3VnU0xpOGVoMGt2ejRiU0x4WXRITWNPaE1yS1ZEeUF5ZGd6N3RLWDdNVlRMbmZUMFRDN2IzVGFkWkE?oc=5,RSS_google_travel,NA,NA,NA,2025-11-02,2025-11-02T09:02:00Z
"Air India Completes First Phase of $400 Million Retrofit of 100+ A320 Family Aircraft, Strengthening Travel Experience on 82 Domestic and Short‑Haul Routes - Travel And Tour World","Air India Completes First Phase of $400 Million Retrofit of 100+ A320 Family Aircraft, Strengthening Travel Experience on 82 Domestic and Short‑Haul Routes&nbsp;&nbsp;Travel And Tour World",https://news.google.com/rss/articles/CBMiswJBVV95cUxNMUV4bWwtTkhNT0N0TnRmRnFfYzd2c3hpMEpSU0duSmFxYUV2VG9kejlFVDNiQ09uLWlvNzZmQm1IM1FmaUU1LS1RcVdfdjlTb2lQblZSUVhtYktCQjBuWDJNeHQ4VjMyU1RIQ0dVTVdiRnJObjlQZGdCQzBuNzRYX1p3N2VEOVpBY1UzQnJqMmRJLWtLcTRudDB2STIwRjFJelNLMDdSZDBlN3JXWUZYQy1ZTkF4WmNsMzdwc19wQldfUm96cEN3cU5jbHlESlUxUjhTX0Z3cjZfUGYzcUdsRzJZQnJSXzd4dGxJSDF4OUZ0eG95T2I3c0hTajc1VS1WdW42VWM3Nm5maEhqUlFNV0xVNTdrYVVjR0JjVnJuc0lTU21ObXBQaDBneklPZ3A3dkRz?oc=5,RSS_google_travel,NA,NA,NA,2025-11-02,2025-11-02T09:02:00Z
"Xiamenair(Singapore) - Airline Tickets, Travel Deals and Flights - xiamenair.com","Xiamenair(Singapore) - Airline Tickets, Travel Deals and Flights&nbsp;&nbsp;xiamenair.com",https://news.google.com/rss/articles/CBMiowFBVV95cUxPTnlvXzlPMVVfZXRZOUFZdjJuMnNnSDRpRmhkclN1eWtMUF9FdmpxSC14M1VYZ3FWNTBsVHJnVW9hRlR2aHRYQzVqU1BIbjVSMUFsZWUzYUVMQ2dLdXpFVzhpaFQwYU00MkVqOGgxZ3JCdER2TTFQcnFUckF4c3BmMUJDanpkOExQN09ZSWVrQWZsVTZ1aUFiUkhfNzdHeThGT3pF?oc=5,RSS_google_travel,NA,NA,NA,2025-11-02,2025-11-02T09:02:00Z
Air Japan to Cease Operations by March 2026: What Travelers Need to Know About the Airline’s Closure - Travel And Tour World,Air Japan to Cease Operations by March 2026: What Travelers Need to Know About the Airline’s Closure&nbsp;&nbsp;Travel And Tour World,https://news.google.com/rss/articles/CBMi4AFBVV95cUxQcFVOZU12MWEtRFRSTDE5cDA0eEVxMFp4c05nZFdZaUloWFl2bWpxLXR2UGZLZzZXa29ETFpQQmFPLUdpN05LU01HOWc1aWd3MVJrOURHYzc1eEhiRmtGOHpYSEphQncxLUVrZ1FQUDFUZ2FscGtNNzV1bGc2RGlRaldOdFpKaVRkQXo0SV8yLVVYQWF1bkRJaU4zUGg5Qm1QSnVFc2pjM2NIRFlKSXhEMkZQdElUNjlrblRreWY4SGUwUW9MWFYwbjV0MXpSWFZwWEJkNUNqMUtpOEEyTk9kWA?oc=5,RSS_google_travel,NA,NA,NA,2025-11-02,2025-11-02T09:02:00Z
United Airlines Delay Highlights How Reliable Air Travel Supports U.S. Tourism Growth - Travel And Tour World,United Airlines Delay Highlights How Reliable Air Travel Supports U.S. Tourism Growth&nbsp;&nbsp;Travel And Tour World,https://news.google.com/rss/articles/CBMizgFBVV95cUxNc2V1bE5rekZ5dlNxRlBXRDd2bUJseXFFUlF6T0dRNXFGWjExc0p4ZkIxZFdWR1ZuZGFFYzJ4WFAtRG9ZN2U0SFc0bHUtcFlVSjlXQjV0RWxNZGdBMVZVOTdXM1VTckdlMk00NkJNblo2ejZDR2JOZGVkNVRMZ2RDTllqT0tHYVMzeWo1MldGUnc4LWZIWVNpX3lETTRKa3FWVDY1aTIyd3FBWW43Y2Y3UEtnSjVXUGpNdFV3UUFBMjgxQTRFQUF5bDQ5dURSdw?oc=5,RSS_google_travel,NA,NA,NA,2025-11-02,2025-11-02T09:02:00Z
"Travel Disarray at Europe And US as Delta Air Lines, Air Iceland, Lufthansa Cancelled 25 Flights Between Fort Lauderdale, Miami, Reykjavik, Oslo, Frankfurt And More - Travel And Tour World","Travel Disarray at Europe And US as Delta Air Lines, Air Iceland, Lufthansa Cancelled 25 Flights Between Fort Lauderdale, Miami, Reykjavik, Oslo, Frankfurt And More&nbsp;&nbsp;Travel And Tour World",https://news.google.com/rss/articles/CBMisAJBVV95cUxOcjJGYXpyb1VQcTlOSk1USzJFc09CcVA4eGJ3MWhXeGNLanVoMlBxd0V5dDBFQWpqeWhBYjVIVi1VME50N1NyYVlQUE5JWlBJMmhVMTRyOTBuOHRham9ubm9lNUg4ZUgwakdZaXlVWUdCMzRuTGlrX1RYcWJzUE9mN3RMZUZmMW1pQmc3S1ZWZVdySzRIZi1WNlJsSGRMRkF2UmxwVE42ZVZxX1VZSkxhcWFweE44R3lyUjZwZGk4MnhVbjQxQmYyTHRxc2VEWm5VOHQxZHVYSVhNSTdqelBBOV9Sc3U2MzdfZ050SDhZSFVZazctT1p0MWdnM2pLd3RONTZka014MDY0dWRtN29DNlRqWEcxRzNVRjRXTENPWVF1Y0JYb3oxLVJMNGR3SHQz?oc=5,RSS_google_travel,NA,NA,NA,2025-11-02,2025-11-02T09:02:00Z
Air Saint-Pierre’s Fascinating Domestic Transatlantic Flight Returning In 2026 - One Mile at a Time,Air Saint-Pierre’s Fascinating Domestic Transatlantic Flight Returning In 2026&nbsp;&nbsp;One Mile at a Time,https://news.google.com/rss/articles/CBMihgFBVV95cUxOLXZkYjc3ak5QS09JdlRBYzg0bGczTXo1QXQ0T1Y4VlJpYVlweUltbXBQS1ViS3hKYlN1SlVObE4wS0NtQUVrVzY1emRQMmQ3UXRibDdlck9sbGF6d0QzYUV0LXUwMEU5TE1QTFRnTDJMNjljQXJyV0cxdUhDekcxa1VVSXZPUQ?oc=5,RSS_google_travel,NA,NA,NA,2025-11-02,2025-11-02T09:02:00Z
Air India 787 Pilots Face Longer Duty Hours as DGCA Extends Flight Time for European Routes: What You Need to Know - Travel And Tour World,Air India 787 Pilots Face Longer Duty Hours as DGCA Extends Flight Time for European Routes: What You Need to Know&nbsp;&nbsp;Travel And Tour World,https://news.google.com/rss/articles/CBMi9AFBVV95cUxON0o4NWhvUHdXVUtCdUlyVldUb2pmRlQ4cUhWaG5rZGgyMDd2UnE5eUYtSnRMaDBTUzczRVBkVGhRSE1zRm5BQWpCS2dyUVlKOU1feVBpUTR1N2RBaFJXZ29RQW1GMnBrYjZXVHg1NWxZUkpQeXg1a05vNktsWGR5MC1OZTl6Uk5TMXRVWU9OSUFuaC1YU3RGdXMwY0JuUkc2aHNvY05pbjhoR09CUDdocEg1TTVZU2FMVHEzUjd0X0x0b0M4Q2dlbHFUZ3Z0OGhnSjB1Y2JaaGUzYjJBdlE5eVpwVlVqbWRsTzdRZDM1MVM0Y0oy?oc=5,RSS_google_travel,NA,NA,NA,2025-11-02,2025-11-02T09:02:00Z
Economic Stability Of Toronto And Montreal Tourism Gets Affected By Air Canada And WestJet Flight Cancellations - Travel And Tour World,Economic Stability Of Toronto And Montreal Tourism Gets Affected By Air Canada And WestJet Flight Cancellations&nbsp;&nbsp;Travel And Tour World,https://news.google.com/rss/articles/CBMi8gFBVV95cUxQUUYtQ2RHTGg1TzhMNGZmX0dFa2xpM0JGbmVHaGxCZlhmSmVaT180S2J5dHgxNUVlX1JyV2FDcmg1VG1qTDI5UURqN1llMFg3LXF2R3RfcjVxdThyVFlmVEdjZExOUkVRQVE1WFVYdDJTbUMzUE1UNXZBSklrUG5yQWY3M0lNWDFiSkt4M2JPZ1Z2OUk5V0pRUkhhWHYtdnRoQ0RQVXJGeVM2cHNGUWpYYzJRcEtsc1VsOE04RXRwMl9aemswa3ZVd2RsQmxkVVdhWmZCXzNSQWRVZ2k5TWhkR284c1NwU1hSTFhmUXJGbXJaUQ?oc=5,RSS_google_travel,NA,NA,NA,2025-11-02,2025-11-02T09:02:00Z
Michelin Flavors Upgraded for All Again! Chef XiamenAir Elevates In-Flight Dining - xiamenair.com,Michelin Flavors Upgraded for All Again! Chef XiamenAir Elevates In-Flight Dining&nbsp;&nbsp;xiamenair.com,https://news.google.com/rss/articles/CBMiowFBVV95cUxNWDc1OS13VDhIYzlRY3NRN20wcUJCY01TSVNIbkQzbW5IQnNlYk1VSEczXzg0Sk4zSjd1Zkh3TXQtU3RDYWFqMk0wc2RxQW84ODhpc1JqMVRvMk9wb3NKRlVSTVJveThuWTJRM2lXNC1hQkpZUU00Z2V5RzUtWjVKRDN4RVBYaE9YdEpTcGRqYmpMa2h2blM5X1hVdkhlNXhCWWtJ?oc=5,RSS_google_travel,NA,NA,NA,2025-11-02,2025-11-02T09:02:00Z
"Air Algérie Launches Direct Flights to Guangzhou and Rotterdam, Strengthening their Tourism and Economic Ties with Asia and Europe - Travel And Tour World","Air Algérie Launches Direct Flights to Guangzhou and Rotterdam, Strengthening their Tourism and Economic Ties with Asia and Europe&nbsp;&nbsp;Travel And Tour World",https://news.google.com/rss/articles/CBMiigJBVV95cUxPOWMzNDYwWnU2bE12bk5JSmlOaXNyRDlDZzJWYUpVcVNxdUhBTm94aUVqN3NwRlZBWkR5UzRIVkozUDBhMGhucXVuSFdyUXRkTHpaN29uVUNxYnZNSXFOUHZ6N1hyNmRMblZncU9wRHoxbDBaNW51TG43Tm1uY0lVMjNGTGhfcUdTTjFEdklLOGlCLS11akxZZ0hDTVZRaWxJMHVuTGRHZ1ZSa2t6RXZaTmtOWll2MnlldFhuX1VCOWZTQnByOG1RVDg2aE9fXzZhOHBuNVl2RVlSaHVtNFJNN0gxa2QxanVwZzc2TjItOGIzWmRoY2RhTGhZLXdyeE9faGZ6TXNDYUpYdw?oc=5,RSS_google_travel,NA,NA,NA,2025-11-02,2025-11-02T09:02:00Z
India climbs into global aviation’s top three - Travel Weekly Asia,India climbs into global aviation’s top three&nbsp;&nbsp;Travel Weekly Asia,https://news.google.com/rss/articles/CBMipwFBVV95cUxOMXlBbWJmbllDUFJPYXdDbDVSdHRQMXV6d0pOel90ZVg1LXpoNnJqRE9rMXZXWVFXdE1SYlhaTlFHeFgtcDFQdnl2UGRXb1pvclFnNzFIZW02M2U3QXpvc2VaYS1EaVE5WkpEX2RGUXJudlpYcVpxVWJTYmVUOEVxaVdyLXIxd19pRWJsemtjLU93aGhaVkkzc3dYdGF1TW5mTFVpdHVPWQ?oc=5,RSS_google_travel,NA,NA,NA,2025-11-02,2025-11-02T09:02:00Z
Airbus partner unveils incredible tech that could transform air travel: 'Marks a significant step forward' - The Cool Down,Airbus partner unveils incredible tech that could transform air travel: 'Marks a significant step forward'&nbsp;&nbsp;The Cool Down,https://news.google.com/rss/articles/CBMihgFBVV95cUxNWHJWMGtyT1F4Q090eDJWLU15RlFmWl9PT2NwNXBjM1FqWnZsVVpueGV6b1kwN0xOUENDYjZTZGdZRThtNC1uVTdzTnQwbUFMS2xsY0JKa0k5d0E1UkQyc29pOTdnWHhxa3g2MEpab2E0al9nQWRiMmZ2SkZKeWxOVnhCenpVZw?oc=5,RSS_google_travel,NA,NA,NA,2025-11-02,2025-11-02T09:02:00Z
Airfare hikes in 2025 are up in the air - Travel Weekly Asia,Airfare hikes in 2025 are up in the air&nbsp;&nbsp;Travel Weekly Asia,https://news.google.com/rss/articles/CBMinwFBVV95cUxQQ2diUUR1VVppVzFCT0duVjVxRjRGelRHR0tVaXp4dnZlTjg0cTB4V0dHQTNzdWJvSjRmQ1puNGxhazd3bUFZc3A5aWxJbUV0ZkczSGZXVEVoSTE0RmdSTzRuY1BrSjBfMXoyRnZOdThrSHNlci0xNWZmeUpSNk9WZm1lYUc4MmxTNEpqRXpYeU1vdFBLUmFBRjlpWVZwbTA?oc=5,RSS_google_travel,NA,NA,NA,2025-11-02,2025-11-02T09:02:00Z
"Air India Joins Air New Zealand, Etihad Airways, United Airlines, Qantas Airways, Emirates Airline, and Singapore Airlines in 2025: Shocking Cabin Upgrades of This Year, That Will Leave You Stunt - Travel And Tour World","Air India Joins Air New Zealand, Etihad Airways, United Airlines, Qantas Airways, Emirates Airline, and Singapore Airlines in 2025: Shocking Cabin Upgrades of This Year, That Will Leave You Stunt&nbsp;&nbsp;Travel And Tour World",https://news.google.com/rss/articles/CBMi2AJBVV95cUxOMC1MTmc2QXpEek42SjNNdGhMSkNMejM5ZG5rejhZR2NWQ2JnZU13akhtb1JOMElIOGhxeE5TOTlFQ2kzcDdFNHpMMFExbWNxVFdGTjRSVmtLSGhhbVNaUlFfYm43RC1kc1c5bU1faXpWR3pxM3p3YmNicFFZLWtGRjE1cEw3V0FoblJSc0FULWxQbWExR3VTRkZCSTZIMG9DeTJ1YmR1RURJRmxZV0FVQlVObU9PSHM2c252bG02TU8tVlNrVjkxc19wZXBUVFA3MXhNNS1jMng4Wm5PME1GYURxT0pwV3U0MWZFTzdYRGhPVENCaVl4N29tNW9FR3QxZ29yVDRHMUcwUjFlV0pXZkVUWUtUWldFZG9kV1FjVWEwMm9FOGVRZzBRbjNWLU82ckFaaW1hLUEtUi1DYzhMTTI5YlVYTDJGM2dXZWZ0UjZRVjJUVHQ5Rg?oc=5,RSS_google_travel,NA,NA,NA,2025-11-02,2025-11-02T09:02:00Z
"Travel Woes for Passengers Across Tanzania, Jordan, Bahrain, Saudi Arabia, and More as FlyDubai, Royal Jordanian, Gulf Air, and Saudia Cancel 16 Flights and Face 69 Delays, Disrupting Routes to Zanzibar, Amman, Riyadh, and Others - Travel And Tour World","Travel Woes for Passengers Across Tanzania, Jordan, Bahrain, Saudi Arabia, and More as FlyDubai, Royal Jordanian, Gulf Air, and Saudia Cancel 16 Flights and Face 69 Delays, Disrupting Routes to Zanzibar, Amman, Riyadh, and Others&nbsp;&nbsp;Travel And Tour World",https://news.google.com/rss/articles/CBMi3gJBVV95cUxOdzNqR0FVaUVJNVkyLXRyMVItQldpUWFXS1gwY21pUXp3bWhTQnBpbjZZdmxsTi1RNnBSNkNnM0VoOVdKdXotWExHTTdVWHFUaHBHWXduanBCZDhzcFNoaHhWTnA0aXNjS1ozTTJobjN4QXRzbHE2NHVkTk1wWEMyMHZtYllZX2k5U21EbGNhUzUtdTF4YllJaXRxMGV4Qm85bV9iU1Zud1dLX2lsMml4aEhZeWdUNEJJa00wdGRiWGY5bklteGJ4blV6eXRjTmdxQXluaVNSLS03blhaWGFqV2VCamdHOERQTG8yeXljWTNPd195eWczT2VjMV9zV0hBNDVBWEpSV045R2JnZV9yWktCRXZYT1BqVXJUaklMWFF4S09JcUt3QWFmVXBQS0lKSDNsSHNmNWhROFc0dFV6emdvSXJuaHVoX201RmNTTFFDbFZaMS1RU3BqajdpZw?oc=5,RSS_google_travel,NA,NA,NA,2025-11-02,2025-11-02T09:02:00Z
Air traffic controller shortages lead to broader US flight delays as shutdown nears one-month mark - WHYY,Air traffic controller shortages lead to broader US flight delays as shutdown nears one-month mark&nbsp;&nbsp;WHYY,https://news.google.com/rss/articles/CBMihwFBVV95cUxQdm5JdHdsSVllWWR5SkNYNnhfZ1lCUUNMRzdwNC1iY1pxR3J4MU0xN2NUaHROa1NlVzRiaE9SSThZVG8wcGhfRW1KX2F4bG96YmNMSVZBdnlZbmRQbFFDN0dWQk5zQnBZajFnSUdUVFhOUVF0VU9SdllxaWQxbTVZX0dDY0V2MUXSAYwBQVVfeXFMTkN4eHRkRHg4Ql9LWjVLSnI4dmU5SXhqczRxLVh4ZUtzLVJ3VmpEYl9XbmVtUWoycnpWbHBNQkEyWHJPNkprVTFmYkNrMHluWEprR3dDZmJKMzdEU1U5T091UWI5MU5uX3NnWEYyMnNZRUxDbVdVeXZGdjB2bHNQdTVXSzRlblc3Wkdaa3Q?oc=5,RSS_google_travel,NA,NA,NA,2025-11-02,2025-11-02T09:02:00Z
"Summer Travel Rush Begins! Xiamen Airlines to Operate Over 40,000 Flights - xiamenair.com","Summer Travel Rush Begins! Xiamen Airlines to Operate Over 40,000 Flights&nbsp;&nbsp;xiamenair.com",https://news.google.com/rss/articles/CBMiowFBVV95cUxOMDNoaktsOTQxTURvM0xvcXh3QnRzSDh5Q2ZfTjhSY2psMWY2STFtUlpLa054SWJmR2Y1Y0FEaW4xZ0gwWTE2WUhKQzRveWo3cl9id3pucW5BVmtZWEJZTGZkNXhUajNVNk0ybTl4SUlacXlTc3RWeHBzVDRJQ0l1Vk1GN2hBZnA2bjN1Zm1mUnFydVZkX2RqbmNwczVFdzNLbmYw?oc=5,RSS_google_travel,NA,NA,NA,2025-11-02,2025-11-02T09:02:00Z
Turbulence at the Top: How Four Airlines Came to Dominate the U.S. Air Travel Market - AeroXplorer,Turbulence at the Top: How Four Airlines Came to Dominate the U.S. Air Travel Market&nbsp;&nbsp;AeroXplorer,https://news.google.com/rss/articles/CBMiugFBVV95cUxQVjB5Z1I4em1CeDQyT3IzTjQxdW1kcFhnUXBlWjJJQTBkWElNeXctNVZ1N0NleGpsLVI0Z3FoQ1hLNGQ4R1NlTHd2WWg4Z3VER0Z4LWJqN1gyVlY4UDhJamdWY1djRnAzXzVSTnltTWFfaUFaUFIzU2lGM003aHMzSncxVDV3V245TEdvV2xDRDBfQVJ0T3B4OU9jT2I4UXdzVnZfUXhWMlJmaVYzWXNVeFFtdGRleGJyRWc?oc=5,RSS_google_travel,NA,NA,NA,2025-11-02,2025-11-02T09:02:00Z
Asia-Pacific's Air Travel Market: Opportunities and Challenges - IATA,Asia-Pacific's Air Travel Market: Opportunities and Challenges&nbsp;&nbsp;IATA,https://news.google.com/rss/articles/CBMiyAFBVV95cUxNZWZoSHphTFZHVFNvXzVQYnlsX2J6eWpJbVpIN09Tc0VGT09iOEFhRElJT1hrVjNFbkhoMWkyZ0E0UDJuempZUFJ3MEdJdTJpeV9kTUZzSFVESlFsMDVvSXdEalY5Tk1OemhscW1VN012SVhEZzhpYS10dWFQcHUzb2pTOFRMNXpjWXB0WFloY0Ffczl5YnBkSGJmeHZZdWRPaXpMSFdHejhRNTduQ3lLQmpHWmtERHQtZFkyS3ZjVjBNazlZNXNwaw?oc=5,RSS_google_travel,NA,NA,NA,2025-11-02,2025-11-02T09:02:00Z
Singapore Airlines Joins VietJet and KLM Exposed in Explosive Greenwashing Scandal and Called Out for Selling the Eco-Friendly Lie as They Have Been Busted for Climate Deception in the Skies and Misleading Sustainable Claims: Everything You Need to - Travel And Tour World,Singapore Airlines Joins VietJet and KLM Exposed in Explosive Greenwashing Scandal and Called Out for Selling the Eco-Friendly Lie as They Have Been Busted for Climate Deception in the Skies and Misleading Sustainable Claims: Everything You Need to&nbsp;&nbsp;Travel And Tour World,https://news.google.com/rss/articles/CBMi6AJBVV95cUxQcXNUaE93bXRhblFNV0tYcXFiMU9LTnZNY2lhTW1WcUd1Qm5zcUw2RUphaklKVW9IcTdIOVRkOEFsSzNyU3k1dHdfdFg4UDJLTEcxcnNFWEFXbHpqbkc1WTZYQnMtUjVfbWtyWlIzOElQa3FETVlPVXM5NDJUekJGV3FZUGtHWkJQRXpzV2s3NldCSUltOUhPbXpSQ2FGR3lSOFYyQmZaV2gtWHItWlR5d0J4R21pRW5Ocm5UREM0Tm1VZWd0bnY5UEgycHJORE85NEhJQkNCLTBJTkx5aW1DUjN1M3owVkNBV2dlTkp6eXRKMHRacTZZRmF6Zl9DUDl2YzJ5TDc4eUtyWkFmcDlRc21WTEhoTFRpRWwxMGRTZU14OHhjOXF5RC1kMms1U1cxY3JOWHRXTnZGbjhNN29rWmVpOUxpYWpTN2VaOWxNaTU0YUEyVFUzTC1ReTFQZnhqSUdKdkxLZWM?oc=5,RSS_google_sia,NA,NA,NA,2025-11-02,2025-11-02T09:01:57Z
Qatar Airways wins ‘Best Airline in the World’ at Business Traveller Awards 2025 - TradeArabia,Qatar Airways wins ‘Best Airline in the World’ at Business Traveller Awards 2025&nbsp;&nbsp;TradeArabia,https://news.google.com/rss/articles/CBMi1wFBVV95cUxPRkQ4N0g1ZDUyeklKcEFtMzRqd3Bvd19NVkFzSEZaVkxFQ0FFMjVzMWtvU1lNNHRrUnZtTWhCNUxkSXJBRzdhbklDV1dzeGFTLTFsZjBlRTAtc2x0Qk1PdUdVVlFlaDFHSjdKUXhleGtCY1EyOTJQLXFvSGhJQ3duUVhXVnBSZzk2VE1HdTRfVmR1MTlvekNxV05qV09vdUFGbHpGRjh3dElYd2k3dHRKVDVLWDlyQVNWd2VnN0EzZ1RWbERDem5JaHFKNHFGa2pydkw1ekxKMA?oc=5,RSS_google_aviation,NA,NA,NA,2025-11-02,2025-11-02T08:52:19Z
"5,000 people, nuclear reactors and jet runways: How modern aircraft carriers power the world’s mightiest navies - WION","5,000 people, nuclear reactors and jet runways: How modern aircraft carriers power the world’s mightiest navies&nbsp;&nbsp;WION",https://news.google.com/rss/articles/CBMi6gFBVV95cUxQdVdEMEpLVmNtOS1odjVkNjRwcE9obFN2NDNYdjluZUo0NDZnYXhJZDBFYkRZNUlVWl9YVk5ucGZkdWZlM2xRYjZEa01WZ29CRF9WdVQ5WW11cW1TdnowOFk4SXhHQ3FIaTNYbGNRVzFMXzFac2k2RWY4aUgxUFNGRTlNMlR4MzJLMHJHdlBaMHVXcnRDZ0l5VGZONlljSGx2cHluaUlYanFYYlN5czZwWWJEQW51NVpJcFlzNGFsX2dVQlhIWDduaEtWVlhYRXlzUFVyc0Eza3FBa0NvVHJIaWJHZWV1YXRacVE?oc=5,RSS_google_aviation,NA,NA,NA,2025-11-02,2025-11-02T08:52:19Z
Cebu Pacific named Asia’s low-cost airline of the year - SunStar Publishing Inc.,Cebu Pacific named Asia’s low-cost airline of the year&nbsp;&nbsp;SunStar Publishing Inc.,https://news.google.com/rss/articles/CBMiogFBVV95cUxOR2ZkMUlFM0ZMR3RwNWhrSGNZR1c0Qy1GRXRhLUl0blpiVUZxQXBmaG9KRU9vMzh1Y2lIMWJKNXVsYm1iMW1mdFJHNGp4OWZZd2dSOEdodXRnbE9iU0J2UVVKdVJYV1RqS3V1SmZubmk4WER4OVNtWkJwNjV4TVRPRjV2OXVtR3VaR0dhamJScTlza0Q1YjdZTzU1bTRJcTV3TFHSAa8BQVVfeXFMT2dIY3NYUUFHdW56d0VYLTZXM2FBQkhYZjc5NTFvZG1MMTZmV3NtbmRfRFprR3F5S0lLOHFSLUxxZEoyMFFtbzZ2S1I0dFJYUmVIblkwZW1jcV90WTBCZ3hGd3hkRFhBQmhmMDBIaFQ3SHdseGNZcnhwTEJoaVIyam9OcW1UMEk4a0lKbHJWSzhlN2pYblF5VEdwZHNHSkQ1b0dDelFWSE1OdGRNUDNlTQ?oc=5,RSS_google_aviation,NA,NA,NA,2025-11-02,2025-11-02T08:52:19Z
When aircraft carriers changed history: Top 5 greatest airstrikes ever launched from sea - WION,When aircraft carriers changed history: Top 5 greatest airstrikes ever launched from sea&nbsp;&nbsp;WION,https://news.google.com/rss/articles/CBMizAFBVV95cUxOY1IxN3VJVXhsTUt5M0M5czlPSHM1ZFdpSW9lQmJyRmZqU2l0ZFpfQkRfWG1uX2lFU1hmY2MyMVV1ZVc5NzN1TFVrVFhyMmhaWXFnT1JPT0RtOW42VEpGN3lfY0pmTmpJUi1vb1IwX0JHb2lfSFpEODhpYzc5UmxDNk9Cazk3Wm9QczVPbnlvakp6Mmh2UEJFMWg0R3JPLVJ3RkViYTV2NlBZcVRuVEpyZGlNb0NMeDF1RHhXVGdrSG5JbkpSMW1FVEpfdDg?oc=5,RSS_google_aviation,NA,NA,NA,2025-11-02,2025-11-02T08:52:19Z
"This popular, affordable carrier has been crowned the most reliable airline in Britain - Time Out","This popular, affordable carrier has been crowned the most reliable airline in Britain&nbsp;&nbsp;Time Out",https://news.google.com/rss/articles/CBMixwFBVV95cUxQY2Q2dHN2bzJYTnNkcXpWM1psaUwzdzc4RnJfUTg0N1hEOVNnTThSQmF0RXY0SWFZZ2M2cGFYZFB2Z0NOLWFjRlBwSkJJN0h3WElFQnV5VFRkU3ZybXB3NS1hWU9sMk9Pa3JVQXAxOFRPdHJzeVBIOHMwQXJmWktvQXVVQXRSNjhUSXNvUTZzRzRKbk5NZk5zeTh4V0dSbFRSMFZ2SkFBV0VPSV9qUkVENEpaaXd3eTJ3azZiZ0hKTEZiWE5kS2lF?oc=5,RSS_google_aviation,NA,NA,NA,2025-11-02,2025-11-02T08:52:19Z
First look: How much do Singapore Airlines KrisFlyer Access awards cost? - The MileLion,First look: How much do Singapore Airlines KrisFlyer Access awards cost?&nbsp;&nbsp;The MileLion,https://news.google.com/rss/articles/CBMipgFBVV95cUxNNkY1RWNaUm5OXzdpcGJVam1BeDRRam1QcWNYdTBXdDR5UzFLSXRhR1pjWnlZNUhwWHdnNzZxYUlGMFd1M3I5bGxnelFJSV80U3VTX3hxbkM3dkRhdk9TUmg5SUY1VS1SRFA5bUdPVDBmcXJoYXc4c3FDbnhVZTFFZEg0NXM0d2Z0bFJ4Y003VEhWcnNDR0k1MGhDc2RFVlJfZ0xJUGVR?oc=5,Google_News_SIA,NA,NA,NA,2025-11-02,2025-11-02T07:54:46Z
"Will provide support, says Singapore Airlines amid Air India seeking ₹10,000 crore aid from owners - livemint.com","Will provide support, says Singapore Airlines amid Air India seeking ₹10,000 crore aid from owners&nbsp;&nbsp;livemint.com",https://news.google.com/rss/articles/CBMi8AFBVV95cUxQY3ZkN1BfODUwSTVRWE0xTV9VeUN3Y1pRLXNmV3VlaUV3MFVmNllPOWJGOHM2ZmtzbHh4ZkZxNlMxbjlEdXNSMlhIdzl4WElqeDY1VENBVGU0Z2tmU2pySTJvS25ER3BrZ2ZIbkpFX2hDb2YxZ09xS2FUWWRVZ1JkZTNfbGRuRDNUUFZBdzdJVURKSmp1UWVFdDZCZ3c0YzZvYUFKZ0I5R0N1RkRBdHpUWUstMk9BaV9YQzN0UFdURFhXaE1jdGM4Z3lCX0ZWTWZRaUl4Q0M2alhEbkF2c3NDVzZTanZnOFRqd0hhUWJ0NjDSAfYBQVVfeXFMUEQxV2VQRF9UbnZ1cmhxalRoUzY2ZzNDYVNVNENUakEzb0s4NjNvSlNEQUk1ZW9Cd3E3dF9XdzBYdHhjOEZLZWZxemJMSXZ3YVR2NWUyc01VQ3dPX3JaamxPRXZFX2x2dVBhU3ZFYWNNNkl3ZmR2a2p5Q2M0VGl1RTRmQjgyMjRBQnU2cWV5N2tQU2RjNUgyYzlIb21IeFAzdHd1dGdKU1B0U1k0Y1FRdnE2YzlhRUl4c0VUOEdXQ2oxWWdyWGl5dkpybVl5cGVsRkJEcXA1aXhzY0tzdUd4VHlkanBnR0JGX0FqZ2lxQ3d4VmpNSWpR?oc=5,Google_News_SIA,NA,NA,NA,2025-11-02,2025-11-02T07:54:46Z
Air India seeks US$1.14 billion lifeline from SIA and Tata: Report - CNA,Air India seeks US$1.14 billion lifeline from SIA and Tata: Report&nbsp;&nbsp;CNA,https://news.google.com/rss/articles/CBMipgFBVV95cUxOd0hXN0RCX1RpVnBhNkNXYlNtSHFmODU3YVoxY1NLaFBCVHF6LW5kUUtfekxwM05BUXJkcjBkMFdDZng3X181UjB6aGxzRDJ0U1N5TFlma0JxOTJWNEQ5TGl5aVRWU1Z2SU9PUGJ6akF5MDgwYmg4MHd6XzRYRUNRel9aOXFONllkdEM2bjlERWhnYjJsd3BDQ2Y1bVgzVjN6TUZwZnZn?oc=5,Google_News_SIA,NA,NA,NA,2025-11-02,2025-11-02T07:54:46Z
Singapore Airlines Partner Carrier Seeks $1.1 Billion After Plane Crash - Aviation A2Z,Singapore Airlines Partner Carrier Seeks $1.1 Billion After Plane Crash&nbsp;&nbsp;Aviation A2Z,https://news.google.com/rss/articles/CBMiogFBVV95cUxOQ2J6ZWRrRGFTbUpDYS1LS3pfbXlhRFhndVVHY2lBT2owWDc3ZExXMTdWcGJNRk85LThJZVFIRTlodS1ReldpSnNUTTlNeEsyX1pTc0JDZHNDNFlBQkE5WV9oSUFmRkppVFllN1N6bGp3V3dLRVNJSzdDRWo0T1ljZ1lFLTBXTElBU0s1ZkJtTDI5VjlSdFdmYTNjcUIyT2Q0c1E?oc=5,Google_News_SIA,NA,NA,NA,2025-11-02,2025-11-02T07:54:46Z
What’s the best Singapore Airlines KrisFlyer redemption per minute? - Mainly Miles,What’s the best Singapore Airlines KrisFlyer redemption per minute?&nbsp;&nbsp;Mainly Miles,https://news.google.com/rss/articles/CBMingFBVV95cUxQN3V1ai05ZDRQYlVpVEJBdFYyRjRuV0xoakhaVkJBNWw5RGdtZmFOT0hlNnB2Nm91STRoYmZGS2dZTmRReTVuMVVSdlRmcWNQMUVtSDJJZTdoVnRlSktWdmFpcU82dXRiRU9zX0FHcWpTbG1NTXg4WnVSZzZNMDZ0NWV2S1pLQmJsRDY0VmJGSXUzY0JhWlh4Q1UxQXJ3QQ?oc=5,Google_News_SIA,NA,NA,NA,2025-11-02,2025-11-02T07:54:46Z
"SIA earnings likely to stay ‘pressured’ despite over 380,000 discounted tickets, say analysts - The Straits Times","SIA earnings likely to stay ‘pressured’ despite over 380,000 discounted tickets, say analysts&nbsp;&nbsp;The Straits Times",https://news.google.com/rss/articles/CBMi3gFBVV95cUxNTXlPZ3FFckJOd2VmSDBiRVhSbXdRM2tZaUtQTDNLRy1KdXJjY0ZpUi14b3RaZ2xnVFRHZVNnZFFya2UtYS1yd1p2b0ZFdHljSFdkSzB4ZkNyZnZlV2xKWEUySExSNUtCc1RQbmZuMFdVSnI5RTZ4WE9EVFlQWHJDWGVQOVNpb2FrNVdERDgtUTZMVU9EWDd3eDZhaU1KMGIyNEV4c0N0ZDhaaENrcEFDb2dWM2NxbVE4ZWlLU21sVFNQb1I0VnNRVXE0cXAwSkxhUndxZ0cwaW84WjIwMXc?oc=5,Google_News_SIA,NA,NA,NA,2025-11-02,2025-11-02T07:54:46Z
"SIA flight from Melbourne dumped fuel before turning back, Crystal Palace beat Liverpool 3-0: Singapore live news - Yahoo News Singapore","SIA flight from Melbourne dumped fuel before turning back, Crystal Palace beat Liverpool 3-0: Singapore live news&nbsp;&nbsp;Yahoo News Singapore",https://news.google.com/rss/articles/CBMi7gFBVV95cUxPSUt0c25FQ0RSek1EbzVFVEVaMGdfSl9Edm15ZnkxNFFXVFhPbHVNajlJQTFjQWVaTDFKZ0VGS29YN1JoN2VCalNTQkU2MDZNYWw4Umx0T2d6d0FXUFpjOTNla0NmR2JYbkxFZXhBYWU2ZjgyTVNQY2NhZlg1Qk82TXE4WWxuQkpMY2RycWRmRk8wQXdMNXI2ZURkX1hISnctUTBTd09NblI1NVVyakl2b0RFcm9sUEVWTElGRDgyaEpPWk9WNnY5YUZDTDV5VTVidFFpbnotY2lMcVhNaFFFdTdtajkzYW5XMTBwd1F3?oc=5,Google_News_SIA,NA,NA,NA,2025-11-02,2025-11-02T07:54:46Z
The 10 Longest Airbus A350-900 Routes In 2025 - Simple Flying,The 10 Longest Airbus A350-900 Routes In 2025&nbsp;&nbsp;Simple Flying,https://news.google.com/rss/articles/CBMibEFVX3lxTE84SnBEOHJYTTAyOHBER2habWY3SXB0VTg2OUlDNExGWENtekdoU3Z5aHdOWGtSWlBwdlRkTl9ValhKcDI2RXVLTXNqUkJYRG9DR204b0NyelVhTXBzUEkzeHNUMGdWdzVjSXFMbw?oc=5,Google_News_SIA,NA,NA,NA,2025-11-02,2025-11-02T07:54:46Z
