headline,description,link,source,author,query_used,pub_datetime,pub_date,scraped_at
Ryanair Lifts Passenger Traffic Goal as Boeing Handovers Improve - Bloomberg.com,Ryanair Lifts Passenger Traffic Goal as Boeing Handovers Improve&nbsp;&nbsp;Bloomberg.com,https://news.google.com/rss/articles/CBMitgFBVV95cUxOLThiUUdYYXFHSEt1cm1iT3hUSGlTVk9tMHk5UlowZUJTQmU1alAtdEliN1Y1OXdybU44UkNXb25LbUU1Q1RtdFROa0RaUmxUT3AwLUNjMmxlNlBVM0RGLW90RnRWdWtlZVNyQ00zQ1BRdUd5YTZrbndiWjVFTDgwVGF0ZVNqME1kVTloTG9mRzBEVVlDbXF4SlVLNFo1WHc5eG9ORWNZczFCWFFIRXBRcGhNZWhqdw?oc=5,RSS_google_boeing,NA,NA,NA,2025-11-03,2025-11-03T06:25:13Z
How The Airbus A321XLR Could Seriously Impact Boeing’s Future - Simple Flying,How The Airbus A321XLR Could Seriously Impact Boeing’s Future&nbsp;&nbsp;Simple Flying,https://news.google.com/rss/articles/CBMiYEFVX3lxTE9KQjFENTBGWGttNFFJUTBqWFZVOFZlbVBlMk1xN1ZORTBoeXNZRmhteE4xVEp1M0oxakRlM2JnWkRGcGNZZjh5eGZncDRPN3Q4N2k0Q0REdTIyRmJkaU1TNA?oc=5,RSS_google_boeing,NA,NA,NA,2025-11-03,2025-11-03T06:25:13Z
Indonesia takes delivery of first A400M - FlightGlobal,Indonesia takes delivery of first A400M&nbsp;&nbsp;FlightGlobal,https://news.google.com/rss/articles/CBMimgFBVV95cUxPclg3RTJ3cU1MbkdSR29UUFJfME1jdDdzbzJCRFpaLWV3NTdwNU1ET2M1cUxqVExZdEZOWUJsYXRra2FhaVBuM0tVOWRncEVnZlRIa1k1eVZUc085Z29hSzY0aHNILXVUTXdudjBOem1IV05aSjVQeDZ2ZnhsQU10T0ViRi1EU0RIblNiZmVfVk4zaDl0Skk2dHFn?oc=5,RSS_google_boeing,NA,NA,NA,2025-11-03,2025-11-03T06:25:13Z
Why Boeing (BA) Stock Is Falling Today - Yahoo Finance,Why Boeing (BA) Stock Is Falling Today&nbsp;&nbsp;Yahoo Finance,https://news.google.com/rss/articles/CBMifkFVX3lxTFAwNnlDVHdvbDRFWUVlYjdZeUR4QTJXZm5Pc2h3Y20zNDJpLUk2bllMVHJsaGc3bXl6eC1pM0x5cmRLTjlpOXNrTlJKc2kxaERVUUFwVTZGcEx0ZmRWTElzb004cjFXbEtCb0JkYWtkS3VhcHBvcXc5NEVTTU1hZw?oc=5,RSS_google_boeing,NA,NA,NA,2025-11-03,2025-11-03T06:25:13Z
Six More A350s: Emirates Strikes JOLCO Financing Deal With HSBC - Simple Flying,Six More A350s: Emirates Strikes JOLCO Financing Deal With HSBC&nbsp;&nbsp;Simple Flying,https://news.google.com/rss/articles/CBMiekFVX3lxTE1PUUk0dlFZcE5VZ2IxcVRRVUlLbWFMdkp6MDlobndscG9Xem9WTFh5S3kzTHNINGdaZVBXRWtHVDBuRmYxbHVTamctUFFrRHVFRWthV2dURHVtWHZTRi1XMm84V1ZTZlBFekl5YlEyeVpKTkF4SXdsTHlR?oc=5,RSS_google_boeing,NA,NA,NA,2025-11-03,2025-11-03T06:25:13Z
Largest Air Force transport Airbus A400M lands in Halim airport - ANTARA News,Largest Air Force transport Airbus A400M lands in Halim airport&nbsp;&nbsp;ANTARA News,https://news.google.com/rss/articles/CBMiowFBVV95cUxOaGZKTnBMOWxnZWktakJ2cm5kTXBDUEd0Z1VKZDNmQkoyNzBaVlJhX3BsREFfakZ5bHZQczZvNG51MjZOcUFRTW9mUmFXNENZZXhDajRMb2pxZGVCOHp2cVU0OWxyOUhEbW92ODlSUHR4eWYxY0E1S2N1MURqX25VX2Z6eUVtUHo3aEZNcTJfWVp6RXFNODhsS0EwdHhxSVZyMU000gGoAUFVX3lxTE1NZW5UQ3BsWk80SWVxLTMyWkdOUm9OVXZWRzg2OGlhQTJCNXFJUDRpY2swVUxuT1JidGJDd3pwWS1jdy05M25TbDdJUTFWQVcxM1ppWEl3NVZGLWFQMXY2eENTU3ROWHcxWUt0dEFxeElxRmgyQnFSekdzd2w1bERXZDc5a2c4OWhoWEFSLVdoU3I3aGJNVXBCSGJNMTJLRTJxWUhMZHRxRQ?oc=5,RSS_google_boeing,NA,NA,NA,2025-11-03,2025-11-03T06:25:13Z
Boeing wins FAA approval to hike 737 MAX production to 42 planes per month - Reuters,Boeing wins FAA approval to hike 737 MAX production to 42 planes per month&nbsp;&nbsp;Reuters,https://news.google.com/rss/articles/CBMixAFBVV95cUxOZkFZSVRCUnhxalBUc01Cd0pQOWR3a015ZWpiVlBtcGxoeWs4dVhjQXJrZllJWDNROHVYTFNSVWhhMXZ3ZjdDc1h4VG9zMWhOWGpOMTFDcjZPRTQ1MzJqZU43SVBRQjg5REpYYnhiV0pFVTliUkU1TlN1U0NjUTlhX2RfN0JXLVZVQmNDckp0eVc4YnJDbE0tV1ViZUUwZm1NQ2daa2VxSFBCUi1iOHNldjV5UTlfZ2hSNVl6US1fcnRCZGhL?oc=5,RSS_google_boeing,NA,NA,NA,2025-11-03,2025-11-03T06:25:13Z
Airbus A320 ousts Boeing 737 as most-delivered jet in history - The Straits Times,Airbus A320 ousts Boeing 737 as most-delivered jet in history&nbsp;&nbsp;The Straits Times,https://news.google.com/rss/articles/CBMipgFBVV95cUxPeHl1aHNqaXZMXzhzVERVMUt0bUptUVNfQjQyYzItaE1PWlByemcwU2pXZ2Y2akI5Q0VXOTZTR2w4ZHZQeHZXMUxMUU5yclQwT1dVaUZ4WUtPYkI5eWpMOVhFNTFpb01TMHJvNk9VNnBSRW9ZcGlGNklra0w1ck9qeFJQc0RJbVh4eTlSblpCcmlYLXB1dE8wQnB0clpYRlNSZFF6WGNB?oc=5,RSS_google_boeing,NA,NA,NA,2025-11-03,2025-11-03T06:25:13Z
"Passengers Face Travel Disruption Across Asia in China, Singapore, Malaysia, Philippines, Vietnam, and Indonesia As Over Forty Flights Are Cancelled By Lufthansa, Air China, British Airways, and More Airlines, Disrupting Routes to Frankfurt, Sydney, Melbo - Travel And Tour World","Passengers Face Travel Disruption Across Asia in China, Singapore, Malaysia, Philippines, Vietnam, and Indonesia As Over Forty Flights Are Cancelled By Lufthansa, Air China, British Airways, and More Airlines, Disrupting Routes to Frankfurt, Sydney, Melbo&nbsp;&nbsp;Travel And Tour World",https://news.google.com/rss/articles/CBMi3AJBVV95cUxPRE9QUllUM3NFUGN4TUxhdUptNjFWVUdJeXhnU2dqMy00N2FBb2VkSXVLZXFkRUNwdGVKdEZ2Sm0xZUk2aTA5blY4N0pFcDhWNGpGZC1JSURHQTlybTNGc20taGxKS1ZpZUVUZmpvT3JNbTVETkYwcnhiaHZuV0NWcWhJdVZNeGRreTc2dkQ5bVNKYWJGNkVZYkZiYWRXOFl0aGVnX3ZaaUFmTzZ4My1keHYwdk5nTW45UE9EWDliS0Rnc29oUDljb291aTBsTnlQaVhXeDJsQ1F6djJWMnh2WmZPZnd0eXd6Qkx6S2otQTFxcGhOQlJGZUxWZTd0YU96Vm9wWjNNb3Bsb2cwTlc4ZjR1RDNyNEtWS1I0UUZOdGdkZjlrXy1xM05qWGZyTHc2YWtFVkpIbGZsdnp1ZEJqNTJCQnVUaEp1TWl6RGJWa29ETXVXRFJzRVg0dHM?oc=5,RSS_google_travel,NA,NA,NA,2025-11-03,2025-11-03T06:25:11Z
Ryanair Redefines the Future of Air Travel by Launching Seamless Digital Paperless Boarding System to Streamline Check-in Process and Boost Passenger Experience - Travel And Tour World,Ryanair Redefines the Future of Air Travel by Launching Seamless Digital Paperless Boarding System to Streamline Check-in Process and Boost Passenger Experience&nbsp;&nbsp;Travel And Tour World,https://news.google.com/rss/articles/CBMiswJBVV95cUxOa0ZnRWdOSElHMjFBUzlrMWZ1NGxjMldDU1IyYkRCUkRmVldERFFjWVFRbjFoOXpQRGJUOGtKOTAzTlczX0RENjJDUEhjOTI1UGhiZFVscjJkVDF0eE9Oa3M0UkFxV1dXSHFHSkNqeHpvRTNDNTNrS3lWMWZnQk9mZElkU3p4c1JfMERDMUp1Z0ZyaTdJWmMtYllxWHNub2RoWDJwZlpLVkZpaXQ0aTlHby1CYWxFNkh3R3hVXzhZb0ZrUkI5V3lDWmZyMUZiQlhGMjBZZi0xcS1OaGZkSmFqMVRKZmU0cFZoUnoycGQxdjFsODJ5bHJoMEF0dml1a1NHSDJpZHN3aHhxeVpORU5jczVFVU1CcHVMZ2IwcVVCaDBVTmhmOS0taUhKUkZnM3BxRFlz?oc=5,RSS_google_travel,NA,NA,NA,2025-11-03,2025-11-03T06:25:11Z
"Phuket Gains Direct Connection To Tashkent With Centrum Air’s New Inaugural Flight, Welcomed By TAT For Thailand–Uzbekistan Tourism Growth - Travel And Tour World","Phuket Gains Direct Connection To Tashkent With Centrum Air’s New Inaugural Flight, Welcomed By TAT For Thailand–Uzbekistan Tourism Growth&nbsp;&nbsp;Travel And Tour World",https://news.google.com/rss/articles/CBMikwJBVV95cUxONXlyT292UHF5SG96Wkx4OGVlV1pSVUNBUTNtajdGOERTZ29MY1hQMkdyR1k4ZHJ3U2EySklHS2NMUnQ1UkJkT2Rzc3lxTEhVRUx6NmFLUWNCbEloTUlya3Y0T0NGNU9sUEhmOVR0SUdwVTREVEg1MmhKWFNuSzFMWHZiaTlPdlFiN24xRVQwa3FSTkpRVzZLSDFCTUFqb2k3VjI1ZlFXandmTU1Jb1hNRnd6ZnIwR3FWT0RyTGZSOUk2Ym8yZW5uSW52c3lBNW53c0FPLWQzZUhBbmJNVTItWThYbjRPb2lrS01kR3VPR1MyYm5aUWh1aWRENEd6TGl4MENrbTFENHE3NXBJcEs4WTNVRQ?oc=5,RSS_google_travel,NA,NA,NA,2025-11-03,2025-11-03T06:25:11Z
"Air Do, ANA, Skymark, and Jetstar Trigger Travel Disruption in Japan as Sixteen Flights Are Cancelled Affecting Key Routes to Tokyo, Fukuoka, Okinawa, Hokkaido, Aichi, and More – New Update You Need to Know - Travel And Tour World","Air Do, ANA, Skymark, and Jetstar Trigger Travel Disruption in Japan as Sixteen Flights Are Cancelled Affecting Key Routes to Tokyo, Fukuoka, Okinawa, Hokkaido, Aichi, and More – New Update You Need to Know&nbsp;&nbsp;Travel And Tour World",https://news.google.com/rss/articles/CBMi2wJBVV95cUxNSnRqc29MbGdqU1FMLUZ4WGJodUptNjd0eFUxQllfNUtMWXEwYUlWcS1URWtXWFowby1VQUZSRDRBVjJtRTdUdzRRclNETTJIMDRUMkhxWUxVMTBORTRGOFhjb0FPTFRseXEwa1ZqUDZ3MWJYRHFZcHdNWE1zYUZOemstUkczeHdwUElhMUlVeXdIenZDQ3J5XzBBcGwya0tTQnVQVEdvcWRmTFVLVWI3c29neE1xcUJJTG40UmNmdzVCNlJhMnp0ZXFKSm9xc2hiRUF3V3lJLXhXaENvUEJCOUplWElvZlNPZUVHcWZId1p4dVNDN184MzBSRjVOdm1fS2luMGtxWEFtNWN6OUhqMGRpNGNHbzlsOWNkOHV4bnpMX2JNNjFfMEk1RlVQS0N4cEtMV3dURTlpUk9fM0ZraFdFOWE2X0Rrb3VuUFZLdEdVWm4xOGpXNFlwTQ?oc=5,RSS_google_travel,NA,NA,NA,2025-11-03,2025-11-03T06:25:11Z
"Italy And Israel Forge Stronger Ties As ITA Airways Resumes Direct Flights From Rome To Tel Aviv, Providing Premium Travel Options And Enhanced Air Access Starting In 2026 - Travel And Tour World","Italy And Israel Forge Stronger Ties As ITA Airways Resumes Direct Flights From Rome To Tel Aviv, Providing Premium Travel Options And Enhanced Air Access Starting In 2026&nbsp;&nbsp;Travel And Tour World",https://news.google.com/rss/articles/CBMiwAJBVV95cUxOd05YYXl6ek1ncHR5c29oY3o0QTBUbGQ0M0JrdS0xeGR3UnJydGRYSFFOdHUwejNTZXBhWEdSalN0YjM5NEp1VEc4SkhyeUE1cHJIdC1yZVFZaGRWcndhX1NldEd6bEdLQTFPd1h5Q3NWN0JDRUpsaGVDX2JUU3M3UUlwYkhYZ3Jmd1hsWFlQblJfR0JfelZFMEFoTG1vVEs5M1E4VmVOYktfY1pmenlsTnNCd1FLZE5xbFZlUkhhOXVlRXd3V0hpcVFWVG40eHJYNUxqcFlCeU4yNUJqdDlqalpmYkxMM2RpMDJpWkI4UldrMVFKQXpyWEFSaGEwUWVMLThjQjdibWV4OTl2NkRBR2FIU0JGckVPeUxoeXctN2lUa0VtMVAwYXE2TnE0YVBHM2JweG9ORG51bWJVVGtWVA?oc=5,RSS_google_travel,NA,NA,NA,2025-11-03,2025-11-03T06:25:11Z
"Cebu Pacific, the Philippines’ leading carrier, is strengthening its fleet in December by entering into a damp lease agreement with Bulgaria Air to meet the expected rise in passenger demand during the peak travel season. - facebook.com","Cebu Pacific, the Philippines’ leading carrier, is strengthening its fleet in December by entering into a damp lease agreement with Bulgaria Air to meet the expected rise in passenger demand during the peak travel season.&nbsp;&nbsp;facebook.com",https://news.google.com/rss/articles/CBMi3wFBVV95cUxNQldUWFdFWEs5d2RxQ1drYTNLNmVrcHM1WjZsS004QTNjSzdNd29JamJxWXIxSGhZMGZyVkhxN0U3UVFFWDNrNTZPTmQ0V2NuQkMwbGc5U3hVMlk0cHpxTU1FSVdZZzJHVTZEWm1lanhCOHNXMUcxczVRWlpGcldLdXR1Wk82VzJnS0RFZ2N0blBEX1ZacDE4R041Z1k1WFk0cE1YSG9TUVJZV0htNkl3bG5DS1IzWC02X1dUVkJkdmZFNVV3bXUzSV9tV3AxUlBmSVBvWl9KR3VXSm0zb0dn?oc=5,RSS_google_travel,NA,NA,NA,2025-11-03,2025-11-03T06:25:11Z
"American Joins Lufthansa, Delta, Air France, LATAM, KLM And More Airlines In Shaping A Strong 2025 With Record Luxury Travel Demand And Expanding Flight Networks - Travel And Tour World","American Joins Lufthansa, Delta, Air France, LATAM, KLM And More Airlines In Shaping A Strong 2025 With Record Luxury Travel Demand And Expanding Flight Networks&nbsp;&nbsp;Travel And Tour World",https://news.google.com/rss/articles/CBMirwJBVV95cUxPbHVEZXRFZmllZ0gyNkJOYmNxbW4zNWxFd25PM09Fb0QyRnZWVGExN09ZZjNfYnFBUDNVNHpNbEp0M1RsY3NLWVVKRkhfUmRya0RrSUpEWWE3TWhTUG9NLTJKMDh2LTZaU2VQcDJzZEwzR09iRkwwN3pLSTBXSDkySjEtRGlnMFNRQlVaa0xLdkxacEtWYkFiUS1iWXJrSmc5dTNsUnNxYVYyRUxyUXFIRG1Ccjg0aVRwUE83UHhQODBYc0VJQ29VNDB6QlpISXItZU0wZHJPeFRrTnF3RmdOa0wyWUdhZHhkVVFabktxMHliSEt3NUI2TW4tc3hqMG96a01Jbm1rTDNEU0I4VFB6S3o5NEwwQWlzNm0wSENXNUtBTkc2UVZ3cVZfYkhNMG8?oc=5,RSS_google_travel,NA,NA,NA,2025-11-03,2025-11-03T06:25:11Z
Flight delays persist as U.S. govt shutdown leads to air traffic controller shortages - The Hindu,Flight delays persist as U.S. govt shutdown leads to air traffic controller shortages&nbsp;&nbsp;The Hindu,https://news.google.com/rss/articles/CBMi4AFBVV95cUxQSG03QUVueXJIR3o2MVNzR29jSl9IQXpiMmVwbC11bkc0M0tselFrSXBBMGJYSnNIeW9iOUtSc1h6aGczZktPSkxIZ3RNaFVhUU9tZDIzV0hnWUdqdloxeGZJdl9jeFJtQzUxbnRFUmQza2tlS05Mam41Vk1TVTkwaXhCZngtNDNSMlNPMjE3V0pZV0pCYWtpdFNUTTlZVzVPSW5XREhrTUF5UDB2WXlIRVVGUng0RGZESVZkbVlFbVFSNG9qSjByNDRWeHZPZDh4dmFHZnZIdUtBUDJMVkRURdIB5wFBVV95cUxNdHVaUUJMZElTU0dLWnZZa1FzU1lnS0RfTnFwekUweDNCXzlhdjB1T2NvVWtsRmJlbHgyX2dhQWpVV3EyOXdmZnZ6cjF3bU5ibTdDcDJKZ2hyY2lnZnlRTzdfei1WU2JNdS1XbXdlMm5WbGJxRWNMb2I2bEdkdXlWMi14ZVZPcHFhNEJxZmgtRmNXQ2Y5NDBNOGxtSmxHYzZ5bFNKaXp5VEJzRkxTd0dEYXpzSldHLUNSMXlKcHA4OEE3OHc1NThUUVNCcGpIcnF4WDFSSlVXNGJoVHFscVc0YnB3cUNKOGs?oc=5,RSS_google_travel,NA,NA,NA,2025-11-03,2025-11-03T06:25:11Z
"NASA’s X-59 Jet Revolutionizes Air Travel in Southern California, Ushering in a New Era of Quiet Supersonic Flights – Here’s Everything That You Need To Know - Travel And Tour World","NASA’s X-59 Jet Revolutionizes Air Travel in Southern California, Ushering in a New Era of Quiet Supersonic Flights – Here’s Everything That You Need To Know&nbsp;&nbsp;Travel And Tour World",https://news.google.com/rss/articles/CBMiqAJBVV95cUxNVU9TQTJ4OHFHQThKSGQwOG1rRXZjLWlheVpWQ0ZOV192NU9vMldzbjFDN3Rjc2FGNlNhNXM1YnhqZV9NRVVBT3B1c1UyM1F1VDZucVNlNi1BQnhIWXhndDJiVVVfOUJ1V3dLcURJQ3ZpcW44eFh2UFJhMWxWS0ZxSzMzN1hkZUJZaVhYandjQjdKU1Z3b1BpRFgtamZXbFZ1enZzQ2lqUXBzLWNwZHNHLXdjNEcwaTFhSHhxSnJ4R3N5Q2lhNlN2LWtwWFJaLTRoLUZJTWl2LVA5WnRadXd5OWE2OWg2NmQ2VnRvSHlzZGZteXk1RHFvZmJzUTBmNXE4QXJzWGVsYkV6MHFqQUFST0dSaUwwaUZCZV9aNjItLU1TdGVPNVNQUA?oc=5,RSS_google_travel,NA,NA,NA,2025-11-03,2025-11-03T06:25:11Z
"Akasa Air Sets its Sights On New International Frontiers With Exciting Routes To Kenya, Ethiopia, Egypt, and More While Expanding Its Fleet For 2026 - Travel And Tour World","Akasa Air Sets its Sights On New International Frontiers With Exciting Routes To Kenya, Ethiopia, Egypt, and More While Expanding Its Fleet For 2026&nbsp;&nbsp;Travel And Tour World",https://news.google.com/rss/articles/CBMinwJBVV95cUxQa0FFRXNVRjEySlcyMG95Y2ZTTVp2NTdYT1V1ZndHQUNSTTNGUU4zYTBPcXBLRGlHU252a3VTVVFNSzFRVnRldFdlRGQ3T2xINEhEQ0xBWlFtejZjUW5RM0xSd1hkaW5JeHZzc0RiX2Z2ckd0Wm90LUVsVk1OVWJIbF9IbjZqbFU3UHBfRGpqWTdwUG40ZUJYbjFqWkh0aHBhQXNobzBieldENVpMb2xSOGtyUGZQNG5VWXdiaWtrdkRJcFQyVXpzQTliTGxvVy1PRURXb1RYMjdETWtUNGhDNjd6WGF6bjZNbThlVmFYWmpLQmZSRmZ4NWlMb3JNbk84ZUZjbG1lTnkzeVRBZUE4VVlxVTZWcl9JVjE4NHlTNA?oc=5,RSS_google_travel,NA,NA,NA,2025-11-03,2025-11-03T06:25:11Z
Korean Air completes Korea’s first verified urban air mobility flight demonstration - APN News,Korean Air completes Korea’s first verified urban air mobility flight demonstration&nbsp;&nbsp;APN News,https://news.google.com/rss/articles/CBMiqwFBVV95cUxOTkNlclVGSFdLM1dTRjFSNHV6VkFwYl9PME1jcnFPN2dmTTY4eldSQ3ZkSGpfMWZLVUEwUFl4aGxRQ21YNjA2MWpvekF1c0REdVB1M240UWVxTElhRUdBTVdTZHhEU0JlYTV5NnRHZkpwNWdVelM2bWRla2ZGSEpEYjNxTHE0WE56TU9QcGJGQmpGMEtQLVJyUUtGY1Q5WWQ5bGpYOHRVSXVJUFk?oc=5,RSS_google_travel,NA,NA,NA,2025-11-03,2025-11-03T06:25:11Z
Big delays at LAX and San Diego airport amid air traffic control staffing shortage - Los Angeles Times,Big delays at LAX and San Diego airport amid air traffic control staffing shortage&nbsp;&nbsp;Los Angeles Times,https://news.google.com/rss/articles/CBMitAFBVV95cUxQSWY4YXFGWEd3bzNHakN5ZWV0bkQwc2tHRWJ1WFRBbkxZVjZvYXRFUVJYbkdhTmpiVmEwME83Qy1xQk4wb254RXJQb3JvYWM0WmtvRENCYVpNY2xGVXFrVWpNc0lzWEViNEdyU28zWGxmdUZhOFZqcFVCVUlNaURTRFktTGpEcGxxTWxJM0FSN1FhQ2E1QmpUOW9acVJaNXZiWEV1SVcyMG10NEIwR200ejZOdGQ?oc=5,RSS_google_travel,NA,NA,NA,2025-11-03,2025-11-03T06:25:11Z
East Air direct Cairns-Hamilton Island flight lands - travelweekly.com.au,East Air direct Cairns-Hamilton Island flight lands&nbsp;&nbsp;travelweekly.com.au,https://news.google.com/rss/articles/CBMihwFBVV95cUxQUE5UWkRkakRTTWFOYmE1WmJ5RGgzdUZyMFh0cmt4N1pZc0hzb2EtREZoZWl1T1lnYjV1ME9OaUxBQ1FjV2laSkFtUWxDTHV3OEJXUUJwNVZmal9FSWItZjMxMDlLMG9lODFuUUx1WXFCRkhyX1NrWjRGQW1Pa2xRY0tjZjZUamM?oc=5,RSS_google_travel,NA,NA,NA,2025-11-03,2025-11-03T06:25:11Z
U.S. Airports On The Edge As Shutdown Drags On With Air Traffic Controllers And TSA Officers Holding The Line Under Extreme Stress Amid Growing Flight Disruptions And Delays - Travel And Tour World,U.S. Airports On The Edge As Shutdown Drags On With Air Traffic Controllers And TSA Officers Holding The Line Under Extreme Stress Amid Growing Flight Disruptions And Delays&nbsp;&nbsp;Travel And Tour World,https://news.google.com/rss/articles/CBMiwwJBVV95cUxQVXIyc2ZVV3V6RTlvcnhqNy1UX3BDSDFBQm51dW51NzgtZHlXS2l0aFQ1QjN6d3V5b09lMVNaYzg5WTBPeHh2OWVkWE9UOUVQemZ5WTFfenMzUDFWWER6Vy1IZWZ1Z1kxc05RNmVZejFUVnRNXzk5a3d3ejg4b0NBOVI4R1pTc25MLXBxWXp2TXVGYk1pbVVWZTEtOXk2ZGhCTjA0bzEzZ0Zka2stMXJMWFYxTU9Xc1l6SzI2TTJXT0tid2NQVl9VM2FrR1lrQkh5U05jaVBTc0N6VE9ZOWtSR1ZBVmdKNnZUT2FHcFlCUnc3VlptYVRhRzZHMEdNZDRFVUM1VEI4c2dUa1M5UTczVV84d1ZqTWVsSjFqbjgtYUVmdFdhYmxlVkFQR0JaTEY2UW15c3Yxd3RFN3ZNSEt3Y1FMUQ?oc=5,RSS_google_travel,NA,NA,NA,2025-11-03,2025-11-03T06:25:11Z
Flight delays persist as government shutdown leads to air traffic controller shortages - BusinessLine,Flight delays persist as government shutdown leads to air traffic controller shortages&nbsp;&nbsp;BusinessLine,https://news.google.com/rss/articles/CBMi8wFBVV95cUxNc2hrQjg3eUNEbklDUDlWcTZ0NHE0WTMwTWVfX1hRX29YUnVUM0VydHBldUp1NDFjR1ZqTG9CREI0Nlk0aUlfUklVcmtYWGVKeVl2dHRERXAxUzRzeEFIWjZLZ0dsbEtiSDNqLVdQbFJQUFQtbWxIbmx5dlQ2VE90b0JqUzlRbGg1b0RhWDRLdDdMdmwwNzhaeHlJUGh3RnM4dEhhVHJVeTVQQmNqVm1jV2psemNFYVFUdEtpWUc5N1VFMlh6cDFBMHZmZlE1YTRwdU9WR014VWVkbjVVNGM1cWQwbTQ3WWdwM2RLTUZVSm9mWEHSAfoBQVVfeXFMTTdTcXVfNi0wbEo0RV9iY3hsa1JiRUdSbkdpQ2Y4akZEZnNDYjdibjBEOVpfZ0Z0SW1BU3p4MlZZOG15RGZZVU05ZXpnX1MxX2hiaHd0NDd3amVidFNZVWNrLXVvY1FsbjBlTTFjWUdhblgxLU5PaUpMWlNEaTloUFZVZmpFdUtXalhBTkRqR0xmakNFNlBZeGtsZ29wY3R5RDh4OGpuQWdaRmx3a2s5Q2g0UkswcGJLT2lRSEQ2VjY3UTJPVXMtRFNBclpJSzJOUkduUmtYOXdib2hNdmo1ZFpJdGZvcHZVbmpKcmgyMXpsbXJkU1ZsZGk0Zw?oc=5,RSS_google_travel,NA,NA,NA,2025-11-03,2025-11-03T06:25:11Z
Air New Zealand Launches Seasonal Flights from Christchurch to Rarotonga for 2026 Getaways - Travel And Tour World,Air New Zealand Launches Seasonal Flights from Christchurch to Rarotonga for 2026 Getaways&nbsp;&nbsp;Travel And Tour World,https://news.google.com/rss/articles/CBMi1gFBVV95cUxNNHlkWkk5bFJDNmptRjlWZW1yLU1kQ2dWRUxwNFVtMjI4bmt5cFlfcWowVjEzWW91eS1uUGZtdEZWMWJ1bUNpQWRRT0ZwNEp0ejBldFhjOUg3Qnl6LVF2YllVbmNfMEprcHB5dC1TaE5aOVhYNWN1OFBYT042MkMyRjVSanlEUzREVC1hWHQxamFrQzlKN0xDZUN6OXQyTi01UUIwc3RTd3hTWDRHNi1aRHI2WkZHc1diYVVVRGUxWE92eWk0S1Izb0ZuUFN1azEtWXI4X0VB?oc=5,RSS_google_travel,NA,NA,NA,2025-11-03,2025-11-03T06:25:11Z
US flight risks rise amid air traffic controller shortage from shutdown - Latest news from Azerbaijan,US flight risks rise amid air traffic controller shortage from shutdown&nbsp;&nbsp;Latest news from Azerbaijan,https://news.google.com/rss/articles/CBMilwFBVV95cUxQOXV6eHRqV2x2RTZTT1JTeWVkdHhQVEtRcEtvdjRxLXpIX09SR0Vtc0lUWGI4X0x2NWtYTG9tV3NSUUpod0czR0pYdU9PaWU1OXpRUzJySHpOcjdHWG92UTF4ZHRSUkh5cDBKSkxCR1pFT1duRjl3cHRZaWh4NmNCUWxWSTRRQWVRU1h3N1FfbzdRakpGY3lF?oc=5,RSS_google_travel,NA,NA,NA,2025-11-03,2025-11-03T06:25:11Z
Sue Bird’s Nike Air Zoom Huarache 2K4 PE Takes Flight in 2026 - Sneaker Freaker Magazine,Sue Bird’s Nike Air Zoom Huarache 2K4 PE Takes Flight in 2026&nbsp;&nbsp;Sneaker Freaker Magazine,https://news.google.com/rss/articles/CBMiowFBVV95cUxQdWFCZXVTdmlUSzVLOS1wUGNpOEpSbmZON2tLVHJPcWlYUTJZXzJ1ZEhJUnQyUGE4bDJSNWRmbHpoZ01YSzd6YjdlRVZiMXhCVFVhOWw0cmNDMVpTVDdtUDJfV05PZUl0R2cyalNsQm9NenA2X2h5SjhOaHoxVFpTNnFpYm5kbVBBVERBbVlGRU1NUHZsaTU0ODZid2ZWTklPMjA4?oc=5,RSS_google_travel,NA,NA,NA,2025-11-03,2025-11-03T06:25:11Z
World’s longest flight where passengers are strapped in for almost 19 hours - Daily Express,World’s longest flight where passengers are strapped in for almost 19 hours&nbsp;&nbsp;Daily Express,https://news.google.com/rss/articles/CBMilAFBVV95cUxOR2g3UWpqeWlCRE51VDhlYUQ4NlEyLUp4T2U1Tk1zNnhUOE4wQ2c0eWVGZE5IZDBRVUVTSlVza3poU0E1UXAxMklDemxnZ0dJSDZzUGo3WjRHbHdFc08tWHR1ZTZKQmtjMjFsZkJ2WHRfNlZGenlZYnFydVpPaGFFMlZPMGpFYUpMUmlmcTA0Q1hfZnh30gGaAUFVX3lxTE0xdWxrUnppZlFwZGwwblZzZkxsRXU3Z1BQVDFlaF9MS1ItaWQxMHgzaDBPZnVVZ19iYW01dVpRVmRKbEkwN2hhUmtEWk1uQ2JhSVZiYTRNcXp4MC1kLWZubElfbkZjXzNUU09ROWpWZDkxQjJNSHJtRk9fM2pfSVVoTHRYQ21jakFNZU1TbkZwdUNvamFobkNFcEE?oc=5,RSS_google_sia,NA,NA,NA,2025-11-03,2025-11-03T06:25:08Z
Singapore Airlines Bullish Breakout & BTS K-Pop Tailwinds: Key Retail Trends for 2025 2 - Minichart,Singapore Airlines Bullish Breakout & BTS K-Pop Tailwinds: Key Retail Trends for 2025 2&nbsp;&nbsp;Minichart,https://news.google.com/rss/articles/CBMiwwFBVV95cUxOUnVnS0dHYUZOUXlra3c0enB2T0l2b2pfdTJzZms2RWRGOWJoRWs0MV85R0RTcFZqYWhyRkdnUGY4aWc5c0pQaFJwT3hieVJXcFRkb3Myd1VUMThLSE5TOGZSWExtVU54RnFqR0twWGZOdXhRQm01cXV3RXRkeVlyY1pEVVl1eU5iQXllZUdxdi1ZQ3JreE5nQmVudlY5ODBvdFFwYWJPaDFKNDdwakVfSzhEdGc1dG9KaWFraS1tXzVZWnc?oc=5,RSS_google_sia,NA,NA,NA,2025-11-03,2025-11-03T06:25:08Z
Qatar Airways Joins Singapore Airlines and 12 Others In Leading the Business Class Charge—Why You Should Upgrade Your Seat Now! - Travel And Tour World,Qatar Airways Joins Singapore Airlines and 12 Others In Leading the Business Class Charge—Why You Should Upgrade Your Seat Now!&nbsp;&nbsp;Travel And Tour World,https://news.google.com/rss/articles/CBMihgJBVV95cUxQeVNGRXlublZiUUtET3kyc0s1RFJKVER6V2wxNDFUcUtMUTYtMWhBSzhVcUNRaVZZbURCVzdNalNMNmNHb1FuRFgtUVZLai0yazJaSm5sOXU4M0xzaXU5U3FaUF9LRmFobnhmb1hNNnJUajRLVnRRVnZZMFQwdTZSWW9nSUJTNEpSU0psY3hoaVFPQV92aWQtSVplOXVUVmRsMDdNTjVodUdWWXNLZEtxRHFwNTRnZWVZMGNrUDdsQnRHYVNTVzR4djlISzllMDlPcXlzbUgxb1JhODQwUDQ1LVd3aWxDaUQwMTdFNWpOeUhpMmRKUUYxWmRWZ1VxNEtPcnhqX0pn?oc=5,RSS_google_sia,NA,NA,NA,2025-11-03,2025-11-03T06:25:08Z
"Air India seeks funds from Tata Sons, Singapore Airlines for upgrades - BusinessLine","Air India seeks funds from Tata Sons, Singapore Airlines for upgrades&nbsp;&nbsp;BusinessLine",https://news.google.com/rss/articles/CBMi0AFBVV95cUxNWld0S1kxd0pkNndBX1JCa0l0ZnQ5ZmQya0JXeXdOV1pzZHNBTVRjbFR3ZGNOMW02NEt5SmhDejZKWUNZaE1XTkIxb0Y5OGJFTDM1Z3BfcXNTcXl4RHhyNktCS3RNRDR1amFNMklWR0p0NzBtWnVFYmd3QTdwem1MSVJENkVZMlg0MUwzVnA4NUNGOEJMdWJtYUpxNHJZRjk5SE9feHYtNkZVcDdOdnFmNTFpamFIYktPV3lqZjJOWWNVLVN2OEFuSEQ3cEQxb1lk0gHXAUFVX3lxTFBPQmNGOVM3Qjd5TUlwMmlSX0dDcGpKVEVxQlE3MGFMNWlhOS01Sm96dGQ1Q05qeElsOUs5cDBab1VYbG1qblRxejJuaU1HVTk5Smd3SHM4RjNfWXRYTGtyTzQyMHVGQUN3U21fdWRaNUdySWZHSHdjRlRZLW9XelJTRGNoaGt3cWRuSThKZTRER2lnMW9FNGo1NUZ1MlRqeEZrcUZRSndBZGJHSElRU3B4YjdnNTJBeC0zbG1wb0wtZ2xXNWRUWHdXNEdXc3BEcGJZZGx5cU5j?oc=5,RSS_google_sia,NA,NA,NA,2025-11-03,2025-11-03T06:25:08Z
Singapore Airlines flights will cost more miles soon - Travel Weekly Asia,Singapore Airlines flights will cost more miles soon&nbsp;&nbsp;Travel Weekly Asia,https://news.google.com/rss/articles/CBMisAFBVV95cUxONVpmWXBteHpJY1FJRmM3X0N0YkNWaEF6UTJxZ0lsay1vLXZ6X3hjVzh3UWQ1S0ZhUGNTSDRVY0F4QUFINlJrd0RBb2phdXJJaVAtOEt0RkhIRS0xME84R3NyMEVLTW81VEdSbFI5UEZZN2h2V195c2RjN1RZb3NBanhCV0tXRG5YcUdkZHZuM09oMlltMmF1eGVwN1BqZkVhWHdZSk9ya0kzX1ktY3NOeQ?oc=5,RSS_google_sia,NA,NA,NA,2025-11-03,2025-11-03T06:25:08Z
Air India completes first phase of legacy retrofit - Asian Aviation,Air India completes first phase of legacy retrofit&nbsp;&nbsp;Asian Aviation,https://news.google.com/rss/articles/CBMikAFBVV95cUxOc1dNQkdoRkpQLVlBTVJ3cnhKdkdreWc2aWxHVS1NWXJWWERmT1JNb09HMHNLZXQtNFBLWWZ0OXdObGFxdHhONGtocUV3a1hETmg0dkpQcm1pMHh6R0ZZVDVPSDRJUVdDclNieG56a3JRNlZabVdqeTdhY2s0Y0wxR1ItelRTNS03TEFHUmFfWTQ?oc=5,RSS_google_aviation,NA,NA,NA,2025-11-03,2025-11-03T06:25:05Z
"In an international win for China’s C919, Brunei accepts Chinese aviation rules - South China Morning Post","In an international win for China’s C919, Brunei accepts Chinese aviation rules&nbsp;&nbsp;South China Morning Post",https://news.google.com/rss/articles/CBMixgFBVV95cUxORHNYZWE2WkRpZlJTNDV1SlBwTFYyVjlBRkhsaWNwamtHcm5yRnlRNFZtVGJhYzZfS2tXV3NIWXNuN2dNMklUbW5HZ1Y2OHlmSDJJYk9QMk5FZjZyWXk2Sk5YeFNDdGhaWDFGVUV4VDkwWm5uclluWUxIdzNzRW9nNjVKa2NXYzlpdVVrNV9TclNSNjN4em1wZkZTLWxmWVlxUGV5YjB5WFYzNEdYNnNrTFFndjlEal96eFU4VzM5bVFfTXpNeGfSAcYBQVVfeXFMT0NuUjA4ZXVqR1VZSjRPckNiYXFOT0ZDLVRGeUVNOThZdDdmTElZT0pIXzAxWmxZdkFsbl9NdE9tMGlfd0g0ZFlKMG1oNkU2Nk1ETHdqQUpaUDFPQUttdFpMUXhFWUtBZnRSQ0pqTTdYMHpQTWVMdzduMF9VeG5rYVlRU1U3WUNaQ2U0OVBNVTlkWlpfdUt6cmJYalQ5em81S1E1ZklURHFNWXVqTEw0VjhTYXRLTGl2a19hNVhZTGVMdWxhOTJn?oc=5,RSS_google_aviation,NA,NA,NA,2025-11-03,2025-11-03T06:25:05Z
Nepal Airlines ordered to ground A320 over engine dispute - ch-aviation,Nepal Airlines ordered to ground A320 over engine dispute&nbsp;&nbsp;ch-aviation,https://news.google.com/rss/articles/CBMingFBVV95cUxPRUpvVVFBb2NaalN1QW1WQXI3VTgzbmVXLXFPdVk4OU5DN3E5dEVQQTZveFlrd05jUEdTRC1xUjBkYnlkZnh3QTNRQlhOZmlKcHUzT2NSYzZQV19yblJrUzhtdnJjcFZGVkk2MG93czJ3QWVLQ1pRMUEzemo0YmNBRU1nRzlrNHVwOWxHOVVDcXY5dmZ3U2hjUlV0V2VyQQ?oc=5,RSS_google_aviation,NA,NA,NA,2025-11-03,2025-11-03T06:25:05Z
Keeree to meet EEC in December to unlock 200-billion-baht incentives for Eastern Aviation City - Nation Thailand,Keeree to meet EEC in December to unlock 200-billion-baht incentives for Eastern Aviation City&nbsp;&nbsp;Nation Thailand,https://news.google.com/rss/articles/CBMiYkFVX3lxTE50VXhlb1puUFBIQ1VPVjNwVDJ6WGZkNWZNWVYzTXA1a2lWUzdSXzJ2bml0UW5uc2dnWUg3N2FYTTRGdElsLUxuQ1ZRWFZnWUlzWXRULUYtcjI0Rzc4ZnJmakFR?oc=5,RSS_google_aviation,NA,NA,NA,2025-11-03,2025-11-03T06:25:05Z
Asia Pacific demand growth has cooled after post-pandemic surge - Centre for Aviation,Asia Pacific demand growth has cooled after post-pandemic surge&nbsp;&nbsp;Centre for Aviation,https://news.google.com/rss/articles/CBMiuAFBVV95cUxQOFVnU0kzV2JaeGg4ZUtXNkd5V0Z2MElJQ2k4ZWxQSjc5a29fbjJfbkQyYU9TRF94OGpyUk91a1hkTWNpX0NCTkR2SXFwT3NfelljeDNSb2pJeF9yWkEtbmg1N1l1YzNKMHZEUklrN2lTR3ZWRjlVU3dwaGlrdGZDa1JiR0ItU2Qxb245Vk1HeWR5QUpnR2QtTEFXOVVfT2lZRWdzVE1mckpWSEhYSk92dzRieVlEeXVS?oc=5,RSS_google_aviation,NA,NA,NA,2025-11-03,2025-11-03T06:25:05Z
Vietnam’s Aviation Landscape Transformed by the Dynamic Launch of Sun PhuQuoc Airways Bringing Affordable Travel and Expanding Global Connections - Travel And Tour World,Vietnam’s Aviation Landscape Transformed by the Dynamic Launch of Sun PhuQuoc Airways Bringing Affordable Travel and Expanding Global Connections&nbsp;&nbsp;Travel And Tour World,https://news.google.com/rss/articles/CBMingJBVV95cUxNYzNKang4Zm9BYXJPVVhPNU5XWXdTRnlRVmh2RjVTb3ZVbzlrcl81VG1GbUpDeDNlTktRd2lYMmN4SXF1UzFOZ3lpa05idWw1STdkOHNReW9UZ2Npa1g0YWNfd0JrNE1Pd21laGN6U1pqbVdvQloyeUQ1MTJwcDNlTEZTUHoxeExFaV9VQ21Eak9LR1prUnBCalc3Qlc0N1FoUFBzOFphVDJmYmRKazd6Zk5IYTJwU0dydm1tajZ6VkpHTllQdGNYVkVUeWlpZkxRMDBQSWNUaFpUTDMza3diR2xOVVJLN2ZsemVuWGdfYnBiUHFkYTM4UWxBSWNRQ1FFTjNlRmFQQ3hTV184bG9DSTczRkY2UHRhbUhpd3d3?oc=5,RSS_google_aviation,NA,NA,NA,2025-11-03,2025-11-03T06:25:05Z
Indonesia Receives First Airbus A400M Military Aircraft - bernama,Indonesia Receives First Airbus A400M Military Aircraft&nbsp;&nbsp;bernama,https://news.google.com/rss/articles/CBMiWkFVX3lxTE82MmpMVGc3S2pqVDFyeWpVU29HWmlSWUVHT0dsY3BLMXMxdGpELTNiTHBsY1ZRSUI0UlNwaUxuN3pKWmNJM1VPdElKaENzMk9DMnh6ek1lSG1nZw?oc=5,RSS_google_aviation,NA,NA,NA,2025-11-03,2025-11-03T06:25:05Z
